,PID,Title,Abstract,Keyword
141,SkF2D7g0b,Exploring the Space of Black-box Attacks on Deep Neural Networks,"Existing black-box attacks on deep neural networks (DNNs) so far have largely focused on transferability, where an adversarial instance generated for a locally trained model can “transfer” to attack other learning models. In this paper, we propose novel Gradient Estimation black-box attacks for adversaries with query access to the target model’s class probabilities, which do not rely on transferability. We also propose strategies to decouple the number of queries required to generate each adversarial sample from the dimensionality of the input. An iterative variant of our attack achieves close to 100% adversarial success rates for both targeted and untargeted attacks on DNNs. We carry out extensive experiments for a thorough comparative evaluation of black-box attacks and show that the proposed Gradient Estimation attacks outperform all transferability based black-box attacks we tested on both MNIST and CIFAR-10 datasets, achieving adversarial success rates similar to well known, state-of-the-art white-box attacks. We also apply the Gradient Estimation attacks successfully against a real-world content moderation classiﬁer hosted by Clarifai. Furthermore, we evaluate black-box attacks against state-of-the-art defenses. We show that the Gradient Estimation attacks are very effective even against these defenses.","['adversarial machine learning', 'black-box attacks']"
142,r1AoGNlC-,Code Synthesis with Priority Queue Training,"We consider the task of program synthesis in the presence of a reward function over the output of programs, where the goal is to find programs with maximal rewards. We introduce a novel iterative optimization scheme, where we train an RNN on a dataset of K best programs from a priority queue of the generated programs so far. Then, we synthesize new programs and add them to the priority queue by sampling from the RNN. We benchmark our algorithm called priority queue training (PQT) against genetic algorithm and reinforcement learning baselines on a simple but expressive Turing complete programming language called BF. Our experimental results show that our deceptively simple PQT algorithm significantly outperforms the baselines. By adding a program length penalty to the reward function, we are able to synthesize short, human readable programs.","['code synthesis', 'program synthesis', 'genetic algorithm', 'reinforcement learning', 'policy gradient', 'reinforce', 'priority queue', 'topk buffer', 'bf', 'code golf', 'rnn']"
143,BJ4prNx0W,Learning what to learn in a neural program,"Learning programs with neural networks is a challenging task, addressed by a long line of existing work. It is difficult to learn neural networks which will generalize to problem instances that are much larger than those used during training. Furthermore, even when the learned neural program empirically works on all test inputs, we cannot verify that it will work on every possible input. Recent work has shown that it is possible to address these issues by using recursion in the Neural Programmer-Interpreter, but this technique requires a verification set which is difficult to construct without knowledge of the internals of the oracle used to generate training data. In this work, we show how to automatically build such a verification set, which can also be directly used for training. By interactively querying an oracle, we can construct this set with minimal additional knowledge about the oracle. We empirically demonstrate that our method allows automated learning and verification of a recursive NPI program with provably perfect generalization.
",[]
144,rJ7RBNe0-,Generative Models for Alignment and Data Efficiency in Language,"We examine how learning from unaligned data can improve both the data efficiency of supervised tasks as well as enable alignments without any supervision. For example, consider unsupervised machine translation: the input is two corpora of English and French, and the task is to translate from one language to the other but without any pairs of English and French sentences. To address this, we develop feature-matching autoencoders (FMAEs). FMAEs ensure that the marginal distribution of feature layers are preserved across forward and inverse mappings between domains. We show that FMAEs achieve state of the art for data efficiency and alignment across three tasks: text decipherment, sentiment transfer, and neural machine translation for English-to-German and English-to-French. Most compellingly, FMAEs achieve state of the art for neural translation with limited supervision, with significant BLEU score differences of up to 5.7 and 6.3 over traditional supervised models. Furthermore, on English-to-German, they outperform last year's best fully supervised models such as ByteNet (Kalchbrenner et al., 2016) while using only half as many supervised examples.",[]
145,rJIN_4lA-,Maintaining cooperation in complex social dilemmas using deep reinforcement learning,"Social dilemmas are situations where individuals face a temptation to increase their payoffs at a cost to total welfare. Building artificially intelligent agents that achieve good outcomes in these situations is important because many real world interactions include a tension between selfish interests and the welfare of others. We show how to modify modern reinforcement learning methods to construct agents that act in ways that are simple to understand, nice (begin by cooperating), provokable (try to avoid being exploited), and forgiving (try to return to mutual cooperation). We show both theoretically and experimentally that such agents can maintain cooperation in Markov social dilemmas. Our construction does not require training methods beyond a modification of self-play, thus if an environment is such that good strategies can be constructed in the zero-sum case (eg. Atari) then we can construct agents that solve social dilemmas in this environment. ","['reinforcement learning', 'cooperation', 'social dilemmas', 'game theory']"
146,rylejExC-,Stochastic Training of Graph Convolutional Networks,"Graph convolutional networks (GCNs) are powerful deep neural networks for graph-structured data. However, GCN computes nodes' representation recursively from their neighbors, making the receptive field size grow exponentially with the number of layers.  Previous attempts on reducing the receptive field size by subsampling neighbors do not have any convergence guarantee, and their receptive field size per node is still in the order of hundreds. In this paper, we develop a preprocessing strategy and two control variate based algorithms to further reduce the receptive field size. Our algorithms are guaranteed to converge to GCN's local optimum regardless of the neighbor sampling size. Empirical results show that our algorithms have a similar convergence speed per epoch with the exact algorithm even using only two neighbors per node. The time consumption of our algorithm on the Reddit dataset is only one fifth of previous neighbor sampling algorithms.","['Graph convolutional networks', 'stochastic gradient descent', 'variance reduction', 'control variate']"
147,r1RF3ExCb,Transformation Autoregressive Networks,"The fundamental task of general density estimation has been of keen interest to machine learning. Recent advances in density estimation have either: a) proposed using a flexible model to estimate the conditional factors of the chain rule; or b) used flexible, non-linear transformations of variables of a simple base distribution. Instead, this work jointly leverages transformations of variables and autoregressive conditional models, and proposes novel methods for both. We provide a deeper understanding of our models, showing a considerable improvement with our methods through a comprehensive study over both real world and synthetic data. Moreover, we illustrate the use of our models in outlier detection and image modeling task.","['density estimation', 'autoregressive models', 'RNNs']"
148,SkYibHlRb,SQLNet: Generating Structured Queries From Natural Language Without Reinforcement Learning,"Synthesizing SQL queries from natural language is a long-standing open problem and has been attracting considerable interest recently. Toward solving the problem, the de facto approach is to employ a sequence-to-sequence-style model. Such an approach will necessarily require the SQL queries to be serialized. Since the same SQL query may have multiple equivalent serializations, training a sequence-to-sequence-style model is sensitive to the choice from one of them. This phenomenon is documented as the ""order-matters"" problem. Existing state-of-the-art approaches rely on reinforcement learning to reward the decoder when it generates any of the equivalent serializations. However, we observe that the improvement from reinforcement learning is limited.
    
In this paper, we propose a novel approach, i.e., SQLNet, to fundamentally solve this problem by avoiding the sequence-to-sequence structure when the order does not matter. In particular, we employ a sketch-based approach where the sketch contains a dependency graph, so that one prediction can be done by taking into consideration only the previous predictions that it depends on. In addition, we propose a sequence-to-set model as well as the column attention mechanism to synthesize the query based on the sketch. By combining all these novel techniques, we show that SQLNet can outperform the prior art by 9% to 13% on the WikiSQL task.",[]
149,SkFEGHx0Z,Nearest Neighbour Radial Basis Function Solvers for Deep Neural Networks,"We present a radial basis function solver for convolutional neural networks that can be directly applied to both distance metric learning and classification problems. Our method treats all training features from a deep neural network as radial basis function centres and computes loss by summing the influence of a feature's nearby centres in the embedding space. Having a radial basis function centred on each training feature is made scalable by treating it as an approximate nearest neighbour search problem. End-to-end learning of the network and solver is carried out, mapping high dimensional features into clusters of the same class. This results in a well formed embedding space, where semantically related instances are likely to be located near one another, regardless of whether or not the network was trained on those classes. The same loss function is used for both the metric learning and classification problems. We show that our radial basis function solver outperforms state-of-the-art embedding approaches on the Stanford Cars196 and CUB-200-2011 datasets. Additionally, we show that when used as a classifier, our method outperforms a conventional softmax classifier on the CUB-200-2011, Stanford Cars196, Oxford 102 Flowers and Leafsnap fine-grained classification datasets.",[]
150,ByCPHrgCW,Deep Learning Inferences with Hybrid Homomorphic Encryption,"When deep learning is applied to sensitive data sets, many privacy-related implementation issues arise. These issues are especially evident in the healthcare, finance, law and government industries. Homomorphic encryption could allow a server to make inferences on inputs encrypted by a client, but to our best knowledge, there has been no complete implementation of common deep learning operations, for arbitrary model depths, using homomorphic encryption. This paper demonstrates a novel approach, efficiently implementing many deep learning functions with bootstrapped homomorphic encryption. As part of our implementation, we demonstrate Single and Multi-Layer Neural Networks, for the Wisconsin Breast Cancer dataset, as well as a Convolutional Neural Network for MNIST. Our results give promising directions for privacy-preserving representation learning, and the return of data control to users.

","['deep learning', 'homomorphic encryption', 'hybrid homomorphic encryption', 'privacy preserving', 'representation learning', 'neural networks']"
151,Hy3MvSlRW,Adversarial reading networks for machine comprehension,"Machine reading has recently shown remarkable progress thanks to differentiable
reasoning models. In this context, End-to-End trainable Memory Networks
(MemN2N) have demonstrated promising performance on simple natural language
based reasoning tasks such as factual reasoning and basic deduction. However,
the task of machine comprehension is currently bounded to a supervised setting
and available question answering dataset. In this paper we explore the paradigm
of adversarial learning and self-play for the task of machine reading comprehension.
Inspired by the successful propositions in the domain of game learning, we
present a novel approach of training for this task that is based on the definition
of a coupled attention-based memory model. On one hand, a reader network is
in charge of finding answers regarding a passage of text and a question. On the
other hand, a narrator network is in charge of obfuscating spans of text in order
to minimize the probability of success of the reader. We experimented the model
on several question-answering corpora. The proposed learning paradigm and associated
models present encouraging results.","['machine reading', 'adversarial training']"
152,SJLy_SxC-,Log-DenseNet: How to Sparsify a DenseNet,"Skip connections are increasingly utilized by deep neural networks to improve accuracy and cost-efficiency. In particular, the recent DenseNet is efficient in computation and parameters, and achieves state-of-the-art predictions by directly connecting each feature layer to all previous ones. However, DenseNet's extreme connectivity pattern may hinder its scalability to high depths, and in applications like fully convolutional networks, full DenseNet connections are prohibitively expensive. 
This work first experimentally shows that one key advantage of skip connections is to have short distances among feature layers during backpropagation. Specifically, using a fixed number of skip connections, the connection patterns with shorter backpropagation distance among layers have more accurate predictions. Following this insight, we propose a connection template, Log-DenseNet, which, in comparison to DenseNet,  only slightly increases the backpropagation distances among layers from 1 to  ($1 + \log_2 L$), but uses only $L\log_2 L$ total connections instead of $O(L^2)$. Hence, \logdenses are easier to scale than DenseNets, and no longer require careful GPU memory management. We demonstrate the effectiveness of our design principle by showing better performance than DenseNets on tabula rasa semantic segmentation, and competitive results on visual recognition.","['DenseNet', 'sparse shortcut connections', 'network architecture', 'scene parsing', 'image classification']"
153,SJiHOSeR-,Contextual memory bandit for pro-active dialog engagement,"An objective of pro-activity in dialog systems is to enhance the usability of conversational
agents by enabling them to initiate conversation on their own. While
dialog systems have become increasingly popular during the last couple of years,
current task oriented dialog systems are still mainly reactive and users tend to
initiate conversations. In this paper, we propose to introduce the paradigm of contextual
bandits as framework for pro-active dialog systems. Contextual bandits
have been the model of choice for the problem of reward maximization with partial
feedback since they fit well to the task description. As a second contribution,
we introduce and explore the notion of memory into this paradigm. We propose
two differentiable memory models that act as parts of the parametric reward estimation
function. The first one, Convolutional Selective Memory Networks, uses
a selection of past interactions as part of the decision support. The second model,
called Contextual Attentive Memory Network, implements a differentiable attention
mechanism over the past interactions of the agent. The goal is to generalize
the classic model of contextual bandits to settings where temporal information
needs to be incorporated and leveraged in a learnable manner. Finally, we illustrate
the usability and performance of our model for building a pro-active mobile
assistant through an extensive set of experiments.","['contextual bandit', 'memory network', 'proactive dialog engagement']"
154,rybDdHe0Z,Sequence Transfer Learning for Neural Decoding,"A fundamental challenge in designing brain-computer interfaces (BCIs) is decoding behavior from time-varying neural oscillations. In typical applications, decoders are constructed for individual subjects and with limited data leading to restrictions on the types of models that can be utilized. Currently, the best performing decoders are typically linear models capable of utilizing rigid timing constraints with limited training data. Here we demonstrate the use of Long Short-Term Memory (LSTM) networks to take advantage of the temporal information present in sequential neural data collected from subjects implanted with electrocorticographic (ECoG) electrode arrays performing a finger flexion task. Our constructed models are capable of achieving accuracies that are comparable to existing techniques while also being robust to variation in sample data size. Moreover, we utilize the LSTM networks and an affine transformation layer to construct a novel architecture for transfer learning. We demonstrate that in scenarios where only the affine transform is learned for a new subject, it is possible to achieve results comparable to existing state-of-the-art techniques. The notable advantage is the increased stability of the model during training on novel subjects. Relaxing the constraint of only training the affine transformation, we establish our model as capable of exceeding performance of current models across all training data sizes. Overall, this work demonstrates that LSTMs are a versatile model that can accurately capture temporal patterns in neural data and can provide a foundation for transfer learning in neural decoding.","['Transfer Learning', 'Applications', 'Neural decoding']"
155,H1bhRHeA-,Unbiased scalable softmax optimization,"Recent neural network and language models have begun to rely on softmax distributions with an extremely large number of categories. In this context calculating the softmax normalizing constant is prohibitively expensive. This has spurred a growing literature of efficiently computable but biased estimates of the softmax. In this paper we present the first two unbiased algorithms for maximizing the softmax likelihood whose work per iteration is independent of the number of classes and datapoints (and does not require extra work at the end of each epoch). We compare our unbiased methods' empirical performance to the state-of-the-art on seven real world datasets, where they comprehensively outperform all competitors.","['softmax', 'optimization', 'implicit sgd']"
156,SJ19eUg0-,BLOCK-DIAGONAL HESSIAN-FREE OPTIMIZATION FOR TRAINING NEURAL NETWORKS,"Second-order methods for neural network optimization have several advantages over methods based on first-order gradient descent, including better scaling to large mini-batch sizes and fewer updates needed for convergence. But they are rarely applied to deep learning in practice because of high computational cost and the need for model-dependent algorithmic variations. We introduce a vari- ant of the Hessian-free method that leverages a block-diagonal approximation of the generalized Gauss-Newton matrix. Our method computes the curvature approximation matrix only for pairs of parameters from the same layer or block of the neural network and performs conjugate gradient updates independently for each block. Experiments on deep autoencoders, deep convolutional networks, and multilayer LSTMs demonstrate better convergence and generalization compared to the original Hessian-free approach and the Adam method.","['deep learning', 'second-order optimization', 'hessian free']"
157,B1mSWUxR-,Softmax Q-Distribution Estimation for Structured Prediction: A Theoretical Interpretation for RAML,"Reward augmented maximum likelihood (RAML), a simple and effective learning framework to directly optimize towards the reward function in structured prediction tasks, has led to a number of impressive empirical successes. RAML incorporates task-specific reward by performing maximum-likelihood updates on candidate outputs sampled according to an exponentiated payoff distribution, which gives higher probabilities to candidates that are close to the reference output. While RAML is notable for its simplicity, efficiency, and its impressive empirical successes, the theoretical properties of RAML, especially the behavior of the exponentiated payoff distribution, has not been examined thoroughly. In this work, we introduce softmax Q-distribution estimation, a novel theoretical interpretation of RAML, which reveals the relation between RAML and Bayesian decision theory. The softmax Q-distribution can be regarded as a smooth approximation of the Bayes decision boundary, and the Bayes decision rule is achieved by decoding with this Q-distribution. We further show that RAML is equivalent to approximately estimating the softmax Q-distribution, with the temperature $\tau$ controlling approximation error. We perform two experiments, one on synthetic data of multi-class classification and one on real data of image captioning, to demonstrate the relationship between RAML and the proposed softmax Q-distribution estimation, verifying our theoretical analysis. Additional experiments on three structured prediction tasks with rewards defined on sequential (named entity recognition), tree-based (dependency parsing) and irregular (machine translation) structures show notable improvements over maximum likelihood baselines.","['structured prediction', 'RAML', 'theory', 'Bayes decision rule', 'reward function']"
158,BkM27IxR-,Learning to Optimize Neural Nets,"Learning to Optimize is a recently proposed framework for learning optimization algorithms using reinforcement learning. In this paper, we explore learning an optimization algorithm for training shallow neural nets. Such high-dimensional stochastic optimization problems present interesting challenges for existing reinforcement learning algorithms. We develop an extension that is suited to learning optimization algorithms in this setting and demonstrate that the learned optimization algorithm consistently outperforms other known optimization algorithms even on unseen tasks and is robust to changes in stochasticity of gradients and the neural net architecture. More specifically, we show that an optimization algorithm trained with the proposed method on the problem of training a neural net on MNIST generalizes to the problems of training neural nets on the Toronto Faces Dataset, CIFAR-10 and CIFAR-100. ","['Learning to learn', 'meta-learning', 'reinforcement learning', 'optimization']"
159,BJLmN8xRW,Character Level Based Detection of DGA Domain Names,"Recently several different deep learning architectures have been proposed that take a string of characters as the raw input signal and automatically derive features for text classification. Little studies are available that compare the effectiveness of these approaches for character based text classification with each other. In this paper we perform such an empirical comparison for the important cybersecurity problem of DGA detection: classifying domain names as either benign vs. produced by malware (i.e., by a Domain Generation Algorithm). Training and evaluating on a dataset with 2M domain names shows that there is surprisingly little difference between various convolutional neural network (CNN) and recurrent neural network (RNN) based architectures in terms of accuracy, prompting a preference for the simpler architectures, since they are faster to train and less prone to overfitting.","['deep neural networks', 'short text classification', 'cybersecurity', 'domain generation algorithms', 'malicious domain names']"
160,SJn0sLgRb,Data Augmentation by Pairing Samples for Images Classification,"Data augmentation is a widely used technique in many machine learning tasks, such as image classification, to virtually enlarge the training dataset size and avoid overfitting. Traditional data augmentation techniques for image classification tasks create new samples from the original training data by, for example, flipping, distorting, adding a small amount of noise to, or cropping a patch from an original image. In this paper, we introduce a simple but surprisingly effective data augmentation technique for image classification tasks. With our technique, named SamplePairing, we synthesize a new sample from one image by overlaying another image randomly chosen from the training data (i.e., taking an average of two images for each pixel). By using two images randomly selected from the training set, we can generate N^2 new samples from N training samples. This simple data augmentation technique significantly improved classification accuracy for all the tested datasets; for example, the top-1 error rate was reduced from 33.5% to 29.0% for the ILSVRC 2012 dataset with GoogLeNet and from 8.22% to 6.93% in the CIFAR-10 dataset. We also show that our SamplePairing technique largely improved accuracy when the number of samples in the training set was very small. Therefore, our technique is more valuable for tasks with a limited amount of training data, such as medical imaging tasks.
","['Data augmentation', 'Image classification']"
