,PID,Title,Abstract,Keyword
423,r16Vyf-0-,Image Transformer,"Image generation has been successfully cast as an autoregressive sequence generation
or transformation problem. Recent work has shown that self-attention is
an effective way of modeling textual sequences. In this work, we generalize a
recently proposed model architecture based on self-attention, the Transformer, to
a sequence modeling formulation of image generation with a tractable likelihood.
By restricting the self-attention mechanism to attend to local neighborhoods we
significantly increase the size of images the model can process in practice, despite
maintaining significantly larger receptive fields per layer than typical convolutional
neural networks. We propose another extension of self-attention allowing it
to efficiently take advantage of the two-dimensional nature of images.
While conceptually simple, our generative models trained on two image data sets
are competitive with or significantly outperform the current state of the art in autoregressive
image generation on two different data sets, CIFAR-10 and ImageNet.
We also present results on image super-resolution with a large magnification ratio,
applying an encoder-decoder configuration of our architecture. In a human
evaluation study, we show that our super-resolution models improve significantly
over previously published autoregressive super-resolution models. Images they
generate fool human observers three times more often than the previous state of
the art.","['image generation', 'super-resolution', 'self-attention', 'transformer']"
424,HymuJz-A-,Not-So-CLEVR: Visual Relations Strain Feedforward Neural Networks,"The robust and efficient recognition of visual relations in images is a hallmark of biological vision. Here, we argue that, despite recent progress in visual recognition, modern machine vision algorithms are severely limited in their ability to learn visual relations. Through controlled experiments, we demonstrate that visual-relation problems strain convolutional neural networks (CNNs). The networks eventually break altogether when rote memorization becomes impossible such as when the intra-class variability exceeds their capacity. We further show that another type of feedforward network, called a relational network (RN), which was shown to successfully solve seemingly difficult visual question answering (VQA) problems on the CLEVR datasets, suffers similar limitations. Motivated by the comparable success of biological vision, we argue that feedback mechanisms including working memory and attention are the key computational components underlying abstract visual reasoning.","['Visual Relations', 'Visual Reasoning', 'SVRT', 'Attention', 'Working Memory', 'Convolutional Neural Network', 'Deep Learning', 'Relational Network']"
425,B14uJzW0b,No Spurious Local Minima in a Two Hidden Unit ReLU Network,"Deep learning models can be efficiently optimized via stochastic gradient descent, but there is little theoretical evidence to support this. A key question in optimization is to understand when the optimization landscape of a neural network is amenable to gradient-based optimization. We focus on a simple neural network two-layer ReLU network with two hidden units, and show that all local minimizers are global. This combined with recent work of Lee et al. (2017); Lee et al. (2016) show that  gradient descent converges to the global minimizer.","['Non-convex optimization', 'Deep Learning']"
426,B1i7ezW0-,Semi-Supervised Learning via New Deep Network Inversion,"We exploit a recently derived inversion scheme for arbitrary deep neural networks to develop a new semi-supervised learning framework that applies to a wide range of systems and problems.  
The approach reaches current state-of-the-art methods on MNIST and provides reasonable performances on SVHN and CIFAR10. Through the introduced method, residual networks are for the first time applied to semi-supervised tasks. Experiments with one-dimensional signals highlight the generality of the method. Importantly, our approach is simple, efficient, and requires no change in the deep network architecture.","['inversion scheme', 'deep neural networks', 'semi-supervised learning', 'MNIST', 'SVHN', 'CIFAR10']"
427,BkA7gfZAb,Stable Distribution Alignment Using the Dual of the Adversarial Distance,"Methods that align distributions by minimizing an adversarial distance between them have recently achieved impressive results. However, these approaches are difficult to optimize with gradient descent and they often do not converge well without careful hyperparameter tuning and proper initialization. We investigate whether turning the adversarial min-max problem into an optimization problem by replacing the maximization part with its dual improves the quality of the resulting alignment and explore its connections to Maximum Mean Discrepancy. Our empirical results suggest that using the dual formulation for the restricted family of linear discriminators results in a more stable convergence to a desirable solution when compared with the performance of a primal min-max GAN-like objective and an MMD objective under the same restrictions. We test our hypothesis on the problem of aligning two synthetic point clouds on a plane and on a real-image domain adaptation problem on digits. In both cases, the dual formulation yields an iterative procedure that gives more stable and monotonic improvement over time.","['domain adaptation', 'adversarial networks', 'statistical distance', 'duality']"
428,ryZElGZ0Z,Discovery of Predictive Representations With a Network of General Value Functions,"The ability of an agent to {\em discover} its own learning objectives has long been considered a key ingredient for artificial general intelligence. Breakthroughs in autonomous decision making and reinforcement learning have primarily been in domains where the agent's goal is outlined and clear: such as playing a game to win, or driving safely. Several studies have demonstrated that learning extramural sub-tasks and auxiliary predictions can improve (1) single human-specified task learning, (2) transfer of learning, (3) and the agent's learned representation of the world. In all these examples, the agent was instructed what to learn about. We investigate a framework for discovery: curating a large collection of predictions, which are used to construct the agent's representation of the world. Specifically, our system maintains a large collection of predictions, continually pruning and replacing predictions. We highlight the importance of considering stability rather than convergence for such a system, and develop an adaptive, regularized algorithm towards that aim. We provide several experiments in computational micro-worlds demonstrating that this simple approach can be effective for discovering useful predictions autonomously.","['Reinforcement Learning', 'General Value Functions', 'Predictive Representations']"
429,r1ISxGZRb,Generation and Consolidation of Recollections for Efficient Deep Lifelong Learning,"Deep lifelong learning systems need to efficiently manage resources to scale to large numbers of experiences and non-stationary goals. In this paper, we explore the relationship between lossy compression and the resource constrained lifelong learning problem of function transferability. We demonstrate that lossy episodic experience storage can enable efficient function transferability between different architectures and algorithms at a fraction of the storage cost of lossless storage. This is achieved by introducing a generative knowledge distillation strategy that does not store any full training examples. As an important extension of this idea, we show that lossy recollections stabilize deep networks much better than lossless sampling in resource constrained settings of lifelong learning while avoiding catastrophic forgetting. For this setting, we propose a novel dual purpose recollection buffer used to both stabilize the recollection generator itself and an accompanying reasoning model. ",[]
430,SktLlGbRZ,CyCADA: Cycle-Consistent Adversarial Domain Adaptation,"Domain adaptation is critical for success in new, unseen environments.
Adversarial adaptation models applied in feature spaces discover domain invariant representations, but are difficult to visualize and sometimes fail to capture pixel-level and low-level domain shifts.
Recent work has shown that generative adversarial networks combined with cycle-consistency constraints are surprisingly effective at  mapping images between domains, even without the use of aligned image pairs.
We propose a novel discriminatively-trained Cycle-Consistent Adversarial Domain Adaptation model.
CyCADA adapts representations at both the pixel-level and feature-level, enforces cycle-consistency while leveraging a task loss, and does not require aligned pairs.  Our model can be applied in a variety of visual recognition and prediction settings.
We show new state-of-the-art results across multiple adaptation tasks, including digit classification and semantic segmentation of road scenes demonstrating transfer from synthetic to real world domains.","['domain adaptation', 'unsupervised learning', 'classification', 'semantic segmentation']"
431,Hk-FlMbAZ,The Manifold Assumption and Defenses Against Adversarial Perturbations,"In the adversarial-perturbation problem of neural networks, an adversary starts with a neural network model $F$ and a point $\bfx$ that $F$ classifies correctly, and applies a \emph{small perturbation} to  $\bfx$ to produce another point $\bfx'$ that $F$ classifies \emph{incorrectly}.  In this paper, we propose taking into account \emph{the inherent confidence information} produced by models when studying adversarial perturbations, where a natural measure of ``confidence'' is \|F(\bfx)\|_\infty$ (i.e. how confident $F$ is about its prediction?). Motivated by a thought experiment based on the manifold assumption, we propose a ``goodness property'' of models which states that \emph{confident regions of a good model should be well separated}. We give formalizations of this property and examine existing robust training objectives in view of them. Interestingly, we find that a recent objective by Madry et al. encourages training a model that satisfies well our formal version of the goodness property, but has a weak control of points that are wrong but with low confidence. However, if Madry et al.'s model is indeed a good solution to their objective, then good and bad points are now distinguishable and we can try to embed uncertain points back to the closest confident region to get (hopefully) correct predictions. We thus propose embedding objectives and algorithms, and perform an empirical study using this method. Our experimental results are encouraging: Madry et al.'s model wrapped with our embedding procedure achieves almost perfect success rate in defending against attacks that the base model fails on, while retaining good generalization behavior.
","['the manifold assumption', 'adversarial perturbation', 'neural networks']"
432,SJvu-GW0b,Graph2Seq: Scalable Learning Dynamics for Graphs,"Neural networks are increasingly used as a general purpose approach to learning algorithms over graph structured data. However, techniques for representing graphs as real-valued vectors are still in their infancy. Recent works have proposed several approaches (e.g., graph convolutional networks), but as we show in this paper, these methods have difficulty generalizing to large graphs. In this paper we propose Graph2Seq, an embedding framework that represents graphs as an infinite time-series. By not limiting the representation to a fixed dimension, Graph2Seq naturally scales to graphs of arbitrary size. Moreover, through analysis of a formal computational model we show that an unbounded sequence is necessary for scalability. Graph2Seq is also reversible, allowing full recovery of the graph structure from the sequence. Experimental evaluations of Graph2Seq on a variety of combinatorial optimization problems show strong generalization and strict improvement over state of the art. ",[]
433,BJJ9bz-0-,Reinforcement Learning from Imperfect Demonstrations,"Robust real-world  learning should benefit from both demonstrations and interaction with the environment. Current approaches to learning from demonstration and reward perform supervised learning on expert demonstration data and use reinforcement learning  to further improve performance based on reward from the environment. These tasks have divergent losses which are difficult to jointly optimize; further, such methods can be very sensitive to noisy demonstrations. We propose a unified reinforcement learning algorithm that effectively normalizes the Q-function, reducing the Q-values of actions unseen in the demonstration data.  Our Normalized Actor-Critic (NAC) method can learn from demonstration data of arbitrary quality and also leverages rewards from an interactive environment.  NAC learns an initial policy network from demonstration and refines the policy in a real environment. Crucially, both learning from demonstration and interactive refinement use exactly the same objective, unlike prior approaches that combine distinct supervised and reinforcement losses. This makes NAC robust to suboptimal demonstration data, since the method is not forced to mimic all of the examples in the dataset. We show that our unified reinforcement learning algorithm can learn robustly and  outperform existing baselines when evaluated on several realistic driving games.","['learning from demonstration', 'reinforcement learning', 'maximum entropy learning']"
434,SyunbfbAb,FigureQA: An Annotated Figure Dataset for Visual Reasoning,"We introduce FigureQA, a visual reasoning corpus of over one million question-answer pairs grounded in over 100,000 images. The images are synthetic, scientific-style figures from five classes: line plots, dot-line plots, vertical and horizontal bar graphs, and pie charts. We formulate our reasoning task by generating questions from 15 templates; questions concern various relationships between plot elements and examine characteristics like the maximum, the minimum, area-under-the-curve, smoothness, and intersection. To resolve, such questions often require reference to multiple plot elements and synthesis of information distributed spatially throughout a figure. To facilitate the training of machine learning systems, the corpus also includes side data that can be used to formulate auxiliary objectives. In particular, we provide the numerical data used to generate each figure as well as bounding-box annotations for all plot elements. We study the proposed visual reasoning task by training several models, including the recently proposed Relation Network as strong baseline. Preliminary results indicate that the task poses a significant machine learning challenge. We envision FigureQA as a first step towards developing models that can intuitively recognize patterns from visual representations of data.","['dataset', 'computer vision', 'deep learning', 'visual reasoning', 'relational reasoning']"
435,Syx6bz-Ab,Seq2SQL: Generating Structured Queries From Natural Language Using Reinforcement Learning ,"Relational databases store a significant amount of the worlds data. However, accessing this data currently requires users to understand a query language such as SQL. We propose Seq2SQL, a deep neural network for translating natural language questions to corresponding SQL queries. Our model uses rewards from in the loop query execution over the database to learn a policy to generate the query, which contains unordered parts that are less suitable for optimization via cross entropy loss. Moreover, Seq2SQL leverages the structure of SQL to prune the space of generated queries and significantly simplify the generation problem. In addition to the model, we release WikiSQL, a dataset of 80654 hand-annotated examples of questions and SQL queries distributed across 24241 tables fromWikipedia that is an order of magnitude larger than comparable datasets. By applying policy based reinforcement learning with a query execution environment to WikiSQL, Seq2SQL outperforms a state-of-the-art semantic parser, improving execution accuracy from 35.9% to 59.4% and logical form accuracy from 23.4% to 48.3%.","['deep learning', 'reinforcement learning', 'dataset', 'natural language processing', 'natural language interface', 'sql']"
436,B1CQGfZ0b,Learning to select examples for program synthesis,"Program synthesis is a class of regression problems where one seeks a solution, in the form of a source-code program, that maps the inputs to their corresponding outputs exactly. Due to its precise and combinatorial nature, it is commonly formulated as a constraint satisfaction problem, where input-output examples are expressed constraints, and solved with a constraint solver. A key challenge of this formulation is that of scalability: While constraint solvers work well with few well-chosen examples, constraining the entire set of example constitutes a significant overhead in both time and memory. In this paper we address this challenge by constructing a representative subset of examples that is both small and is able to constrain the solver sufficiently. We build the subset one example at a time, using a trained discriminator to predict the probability of unchosen input-output examples conditioned on the chosen input-output examples, adding the least probable example to the subset. Experiment on a diagram drawing domain shows our approach produces subset of examples that are small and representative for the constraint solver.","['program synthesis', 'program induction', 'example selection']"
437,BkfEzz-0-,Neuron as an Agent,"Existing multi-agent reinforcement learning (MARL) communication methods have relied on a trusted third party (TTP) to distribute reward to agents, leaving them inapplicable in peer-to-peer environments. This paper proposes reward distribution using {\em Neuron as an Agent} (NaaA) in MARL without a TTP with two key ideas: (i) inter-agent reward distribution and (ii) auction theory. Auction theory is introduced because inter-agent reward distribution is insufficient for optimization. Agents in NaaA maximize their profits (the difference between reward and cost) and, as a theoretical result, the auction mechanism is shown to have agents autonomously evaluate counterfactual returns as the values of other agents. NaaA enables representation trades in peer-to-peer environments, ultimately regarding unit in neural networks as agents. Finally, numerical experiments (a single-agent environment from OpenAI Gym and a multi-agent environment from ViZDoom) confirm that NaaA framework optimization leads to better performance in reinforcement learning.","['Multi-agent Reinforcement Learning', 'Communication', 'Reward Distribution', 'Trusted Third Party', 'Auction Theory']"
438,H1u8fMW0b,Toward predictive machine learning for active vision,"We develop a comprehensive description of the active inference framework, as proposed by Friston (2010), under a machine-learning compliant perspective. Stemming from a biological inspiration and the auto-encoding principles, a sketch of a cognitive architecture is proposed that should provide ways to implement estimation-oriented control policies.  Computer simulations illustrate the effectiveness of the approach through a foveated inspection of the input data. The pros and cons of the control policy are analyzed in detail, showing interesting promises in terms of processing compression. Though optimizing future posterior entropy over the actions set is shown enough to attain locally optimal action selection, offline calculation using class-specific saliency maps is shown better for it saves processing costs through saccades pathways pre-processing, with a negligible effect on the recognition/compression rates. ","['active inference', 'predictive coding', 'motor control']"
439,Bya8fGWAZ,Value Propagation Networks,"We present Value Propagation (VProp), a parameter-efficient differentiable planning module built on Value Iteration which can successfully be trained in a reinforcement learning fashion to solve unseen tasks, has the capability to generalize to larger map sizes, and can learn to navigate in dynamic environments. We evaluate on configurations of MazeBase grid-worlds, with randomly generated environments of several different sizes. Furthermore, we show that the module enables to learn to plan when the environment also includes stochastic elements, providing a cost-efficient learning system to build low-level size-invariant planners for a variety of interactive navigation problems.","['Learning to plan', 'Reinforcement Learning', 'Value Iteration', 'Navigation', 'Convnets']"
440,H18uzzWAZ,Correcting Nuisance Variation using Wasserstein Distance,"Profiling cellular phenotypes from microscopic imaging can provide meaningful biological information resulting from various factors affecting the cells. One motivating application is drug development: morphological cell features can be captured from images, from which similarities between different drugs applied at different dosages can be quantified. The general approach is to find a function mapping the images to an embedding space of manageable dimensionality whose geometry captures relevant features of the input images. An important known issue for such methods is separating relevant biological signal from nuisance variation. For example, the embedding vectors tend to be more correlated for cells that were cultured and imaged during the same week than for cells from a different week, despite having identical drug compounds applied in both cases. In this case, the particular batch a set of experiments were conducted in constitutes the domain of the data; an ideal set of image embeddings should contain only the relevant biological information (e.g. drug effects). We develop a general framework for adjusting the image embeddings in order to `forget' domain-specific information while preserving relevant biological information. To do this, we minimize a loss function based on distances between marginal distributions (such as the Wasserstein distance) of embeddings across domains for each replicated treatment. For the dataset presented, the replicated treatment is the negative control. We find that for our transformed embeddings (1) the underlying geometric structure is not only preserved but the embeddings also carry improved biological signal (2) less domain-specific information is present.","['Nuisance variation', 'transform learning', 'image embeddings']"
441,rkEtzzWAb,Parametric Adversarial Divergences are Good Task Losses for Generative Modeling,"Generative modeling of high dimensional data like images is a notoriously difficult and ill-defined problem. In particular, how to evaluate a learned generative model is unclear.
In this paper, we argue that *adversarial learning*, pioneered with generative adversarial networks (GANs), provides an interesting framework to implicitly define more meaningful task losses for unsupervised tasks, such as for generating ""visually realistic"" images. By relating GANs and structured prediction under the framework of statistical decision theory, we put into light links between recent advances in structured prediction theory and the choice of the divergence in GANs. We argue that the insights about the notions of ""hard"" and ""easy"" to learn losses can be analogously extended to adversarial divergences. We also discuss the attractive properties of parametric adversarial divergences for generative modeling, and perform experiments to show the importance of choosing a divergence that reflects the final task.","['parametric', 'adversarial', 'divergence', 'generative', 'modeling', 'gan', 'neural', 'network', 'task', 'loss', 'structured', 'prediction']"
442,SJZ2Mf-0-,Adaptive Memory Networks,"Real-world Question Answering (QA) tasks consist of thousands of words that often represent many facts and entities. Existing models based on LSTMs require a large number of parameters to support external memory and do not generalize well for long sequence inputs. Memory networks attempt to address these limitations by storing information to an external memory module but must examine all inputs in the memory. Hence, for longer sequence inputs the intermediate memory components proportionally scale in size resulting in poor inference times and high computation costs.

In this paper, we present Adaptive Memory Networks (AMN) that process input question pairs to dynamically construct a network architecture optimized for lower inference times. During inference, AMN parses input text into entities within different memory slots. However, distinct from previous approaches, AMN is a dynamic network architecture that creates variable numbers of memory banks weighted by question relevance. Thus, the decoder can select a variable number of memory banks to construct an answer using fewer banks, creating a runtime trade-off between accuracy and speed. 

AMN is enabled by first, a novel bank controller that makes discrete decisions with high accuracy and second, the capabilities of a dynamic framework (such as PyTorch) that allow for dynamic network sizing and efficient variable mini-batching. In our results, we demonstrate that our model learns to construct a varying number of memory banks based on task complexity and achieves faster inference times for standard bAbI tasks, and modified bAbI tasks. We achieve state of the art accuracy over these tasks with an average 48% lower entities are examined during inference.","['Memory Networks', 'Dynamic Networks', 'Faster Inference', 'Reasoning', 'QA']"
