,PID,Title,Abstract,Keyword
0,ByED-X-0W,Parametric Information Bottleneck to Optimize Stochastic Neural Networks,"In this paper, we present a layer-wise learning of stochastic neural networks (SNNs) in an information-theoretic perspective. In each layer of an SNN, the compression and the relevance are defined to quantify the amount of information that the layer contains about the input space and the target space, respectively. We jointly optimize the compression and the relevance of all parameters in an SNN to better exploit the neural network's representation. Previously, the Information Bottleneck (IB) framework (\cite{Tishby99}) extracts relevant information for a target variable. Here, we propose Parametric Information Bottleneck (PIB) for a neural network by utilizing (only) its model parameters explicitly to approximate the compression and the relevance. We show that, as compared to the maximum likelihood estimate (MLE) principle, PIBs : (i) improve the generalization of neural networks in classification tasks, (ii) push the representation of neural networks closer to the optimal information-theoretical representation in a faster manner.  ","['Information Bottleneck', 'Deep Neural Networks']"
1,S1pWFzbAW,Weightless: Lossy Weight Encoding For Deep Neural Network Compression,"The large memory requirements of deep neural networks strain the capabilities of many devices, limiting their deployment and adoption. Model compression methods effectively reduce the memory requirements of these models, usually through applying transformations such as weight pruning or quantization. In this paper, we present a novel scheme for lossy weight encoding which complements conventional compression techniques. The encoding is based on the Bloomier filter, a probabilistic data structure that can save space at the cost of introducing random errors. Leveraging the ability of neural networks to tolerate these imperfections and by re-training around the errors, the proposed technique, Weightless, can compress DNN weights by up to 496x; with the same model accuracy, this results in up to a 1.51x improvement over the state-of-the-art.","['Deep Neural Network', 'Compression', 'Sparsity']"
2,Skx5txzb0W,A Boo(n) for Evaluating Architecture Performance,"We point out important problems with the common practice of using the best single model performance for comparing deep learning architectures, and we propose a method that corrects these flaws. Each time a model is trained, one gets a different result due to random factors in the training process, which include random parameter initialization and random data shuffling. Reporting the best single model performance does not appropriately address this stochasticity. We propose a normalized expected best-out-of-n performance (Boo_n) as a way to correct these problems.","['evaluation', 'methodology']"
3,BywyFQlAW,Minimax Curriculum Learning: Machine Teaching with Desirable Difficulties and Scheduled Diversity,"We introduce and study minimax curriculum learning (MCL), a new method for adaptively selecting a sequence of training subsets for a succession of stages in machine learning. The subsets are encouraged to be small and diverse early on, and then larger, harder, and allowably more homogeneous in later stages. At each stage, model weights and training sets are chosen by solving a joint continuous-discrete minimax optimization, whose objective is composed of a continuous loss (reflecting training set hardness) and a discrete submodular promoter of diversity for the chosen subset. MCL repeatedly solves a sequence of such optimizations with a schedule of increasing training set size and decreasing pressure on diversity encouragement. We reduce MCL to the minimization of a surrogate function handled by submodular maximization and continuous gradient methods. We show that MCL achieves better performance and, with a clustering trick, uses fewer labeled samples for both shallow and deep models while achieving the same performance. Our method involves repeatedly solving constrained submodular maximization of an only slowly varying function on the same ground set. Therefore, we develop a heuristic method that utilizes the previous submodular maximization solution as a warm start for the current submodular maximization process to reduce computation while still yielding a guarantee.","['machine teaching', 'deep learning', 'minimax', 'curriculum learning', 'submodular', 'diversity']"
4,rJiaRbk0-,Towards Binary-Valued Gates for Robust LSTM Training ,"Long Short-Term Memory (LSTM) is one of the most widely used recurrent structures in sequence modeling. Its goal is to use gates to control the information flow (e.g., whether to skip some information/transformation or not) in the recurrent computations, although its practical implementation based on soft gates only partially achieves this goal and is easy to overfit. In this paper, we propose a new way for LSTM training, which pushes the values of the gates towards 0 or 1. By doing so, we can (1) better control the information flow: the gates are mostly open or closed, instead of in a middle state; and (2) avoid overfitting to certain extent: the gates operate at their flat regions, which is shown to correspond to better generalization ability. However, learning towards discrete values of the gates is generally difficult. To tackle this challenge, we leverage the recently developed Gumbel-Softmax trick from the field of variational methods, and make the model trainable with standard backpropagation. Experimental results on language modeling and machine translation show that (1) the values of the gates generated by our method are more reasonable and intuitively interpretable, and (2) our proposed method generalizes better and achieves better accuracy on test sets in all tasks. Moreover, the learnt models are not sensitive to low-precision approximation and low-rank approximation of the gate parameters due to the flat loss surface.","['recurrent neural network', 'LSTM', 'long-short term memory network', 'machine translation', 'generalization']"
5,B14TlG-RW,QANet: Combining Local Convolution with Global Self-Attention for Reading Comprehension," Current end-to-end machine reading and question answering (Q\&A) models are primarily based on recurrent neural networks (RNNs) with attention. Despite their success, these models are often slow for both training and inference due to the sequential nature of RNNs. We propose a new Q\&A architecture called QANet, which does not require recurrent networks:  Its encoder consists exclusively of convolution and self-attention, where convolution models local interactions and self-attention models global interactions. On the SQuAD dataset, our model is 3x to 13x faster in training and 4x to 9x faster in inference, while achieving equivalent accuracy to recurrent models. The speed-up gain allows us to train the model with much more data. We hence combine our model with data generated by backtranslation from a neural machine translation model. 
On the SQuAD dataset, our single model, trained with augmented data, achieves 84.6 F1 score on the test set, which is significantly better than the best published F1 score of 81.8.","['squad', 'stanford question answering dataset', 'reading comprehension', 'attention', 'text convolutions', 'question answering']"
6,HJNMYceCW,Residual Loss Prediction: Reinforcement Learning With No Incremental Feedback,"We consider reinforcement learning and bandit structured prediction problems with very sparse loss feedback: only at the end of an episode. We introduce a novel algorithm, RESIDUAL LOSS PREDICTION (RESLOPE), that solves such problems by automatically learning an internal representation of a denser reward function. RESLOPE operates as a reduction to contextual bandits, using its learned loss representation to solve the credit assignment problem, and a contextual bandit oracle to trade-off exploration and exploitation. RESLOPE enjoys a no-regret reduction-style theoretical guarantee and outperforms state of the art reinforcement learning algorithms in both MDP environments and bandit structured prediction settings.","['Reinforcement Learning', 'Structured Prediction', 'Contextual Bandits', 'Learning Reduction']"
7,ryALZdAT-,Feature Incay for Representation Regularization,"Softmax-based loss is widely used in deep learning for multi-class classification, where each class is represented by a weight vector and each sample is represented as a feature vector. Different from traditional learning algorithms where features are pre-defined and only weight vectors are tunable through training, feature vectors are also tunable as representation learning in deep learning. Thus we investigate how to improve the classification performance by better adjusting the features. One main observation is that elongating the feature norm of both correctly-classified and mis-classified feature vectors improves learning: (1) increasing the feature norm of correctly-classified examples induce smaller training loss; (2) increasing the feature norm of mis-classified examples can upweight the contribution from hard examples. Accordingly, we propose feature incay to regularize representation learning by encouraging larger feature norm. In contrast to weight decay which shrinks the weight norm, feature incay is proposed to stretch the feature norm. Extensive empirical results on MNIST, CIFAR10, CIFAR100 and LFW demonstrate the effectiveness of feature incay. ","['feature norm', 'regularization', 'softmax loss', 'feature incay']"
8,SkERSm-0-,Preliminary theoretical troubleshooting in Variational Autoencoder,"What would be learned by variational autoencoder(VAE) and what influence the disentanglement of VAE? This paper tries to preliminarily address VAE's intrinsic dimension, real factor, disentanglement and indicator issues theoretically in the idealistic situation and implementation issue practically through noise modeling perspective in the realistic case.  On intrinsic dimension issue, due to information conservation, the idealistic VAE learns and only learns intrinsic factor dimension. Besides, suggested by mutual information separation property, the constraint induced by Gaussian prior to the VAE objective encourages the information sparsity in dimension. On disentanglement issue,   subsequently, inspired by information conservation theorem the clarification on disentanglement in this paper is made. On real factor issue, due to factor equivalence, the idealistic VAE possibly learns any factor set in the equivalence class.  On indicator issue, the behavior of current disentanglement metric is discussed, and several performance indicators regarding the disentanglement and generating influence are subsequently raised to evaluate the performance of VAE model and to supervise the used factors. On implementation issue, the experiments under noise modeling and constraints empirically testify the theoretical analysis and also show their own characteristic in pursuing disentanglement.","['variational autoencoder', 'information theory', 'noise modelling', 'representation learning', 'generative model', 'disentanglement']"
9,HknbyQbC-,Generating Adversarial Examples with Adversarial Networks,"Deep neural networks (DNNs) have been found to be vulnerable to adversarial examples resulting from adding small-magnitude perturbations to inputs. Such adversarial examples can mislead DNNs to produce adversary-selected results.
Different attack strategies have been proposed to generate adversarial examples, but how to produce them with high perceptual quality and more efficiently requires more research efforts. 
In this paper, we propose AdvGAN to generate adversarial examples with generative adversarial networks (GANs), which can learn and approximate the distribution of original instances. 
For AdvGAN, once the generator is trained, it can generate adversarial perturbations efficiently for any instance, so as to potentially accelerate adversarial training as defenses.  
We apply AdvGAN in both semi-whitebox and black-box attack settings. In semi-whitebox attacks, there is no need to access the original target model after the generator is trained, in contrast to traditional white-box attacks. In black-box attacks, we dynamically train a distilled model for the black-box model and optimize the generator accordingly.
Adversarial examples generated by AdvGAN on different target models have high attack success rate under state-of-the-art defenses compared to other attacks. Our attack  has placed the first with 92.76% accuracy on a public MNIST black-box attack challenge. ","['adversarial examples', 'generative adversarial network', 'black-box attack']"
10,rkxY-sl0W,Tree-to-tree Neural Networks for Program Translation,"Program translation is an important tool to migrate legacy code in one language into an ecosystem built in a different language. In this work, we are the first to consider employing deep neural networks toward tackling this problem. We observe that program translation is a modular procedure, in which a sub-tree of the source tree is translated into the corresponding target sub-tree at each step. To capture this intuition, we design a tree-to-tree neural network as an encoder-decoder architecture to translate a source tree into a target one. Meanwhile, we develop an attention mechanism for the tree-to-tree model, so that when the decoder expands one non-terminal in the target tree, the attention mechanism locates the corresponding sub-tree in the source tree to guide the expansion of the decoder. We evaluate the program translation capability of our tree-to-tree model against several state-of-the-art approaches. Compared against other neural translation models, we observe that our approach is consistently better than the baselines with a margin of up to 15 points. Further, our approach can improve the previous state-of-the-art program translation approaches by a margin of 20 points on the translation of real-world projects.",[]
11,HylgYB3pZ,Linearly Constrained Weights: Resolving the Vanishing Gradient Problem by Reducing Angle Bias,"In this paper, we first identify \textit{angle bias}, a simple but remarkable phenomenon that causes the vanishing gradient problem in a multilayer perceptron (MLP) with sigmoid activation functions. We then propose \textit{linearly constrained weights (LCW)} to reduce the angle bias in a neural network, so as to train the network under the constraints that the sum of the elements of each weight vector is zero. A reparameterization technique is presented to efficiently train a model with LCW by embedding the constraints on weight vectors into the structure of the network. Interestingly, batch normalization (Ioffe & Szegedy, 2015) can be viewed as a mechanism to correct angle bias. Preliminary experiments show that LCW helps train a 100-layered MLP more efficiently than does batch normalization.","['vanishing gradient problem', 'multilayer perceptron', 'angle bias']"
12,SyrGJYlRZ,YellowFin and the Art of Momentum Tuning,"Hyperparameter tuning is one of the most time-consuming workloads in deep learning. State-of-the-art optimizers, such as AdaGrad, RMSProp and Adam, reduce this labor by adaptively tuning an individual learning rate for each variable. Recently researchers have shown renewed interest in simpler methods like momentum SGD as they may yield better results. Motivated by this trend, we ask: can simple adaptive methods, based on SGD perform as well or better? We revisit the momentum SGD algorithm and show that hand-tuning a single learning rate and momentum makes it competitive with Adam. We then analyze its robustness to learning rate misspecification and objective curvature variation. Based on these insights, we design YellowFin, an automatic tuner for momentum and learning rate in SGD. YellowFin optionally uses a negative-feedback loop to compensate for the momentum dynamics in asynchronous settings on the fly. We empirically show YellowFin can converge in fewer iterations than Adam on ResNets and LSTMs for image recognition, language modeling and constituency parsing, with a speedup of up to $3.28$x in synchronous and up to $2.69$x in asynchronous settings.","['adaptive optimizer', 'momentum', 'hyperparameter tuning']"
13,Hk2MHt-3-,Coupled Ensembles of Neural Networks,"We investigate in this paper the architecture of deep convolutional networks. Building on existing state of the art models, we propose a reconfiguration of the model parameters into several parallel branches at the global network level, with each branch being a standalone CNN. We show that this arrangement is an efficient way to significantly reduce the number of parameters while at the same time improving the performance. The use of branches brings an additional form of regularization. In addition to splitting the parameters into parallel branches, we propose a tighter coupling of these branches by averaging their log-probabilities. The tighter coupling favours the learning of better representations, even at the level of the individual branches, as compared to when each branch is trained independently. We refer to this branched architecture as ""coupled ensembles"". The approach is very generic and can be applied with almost any neural network architecture. With coupled ensembles of DenseNet-BC and parameter budget of 25M, we obtain error rates of 2.92%, 15.68% and 1.50% respectively on CIFAR-10, CIFAR-100 and SVHN tasks. For the same parameter budget, DenseNet-BC has an error rate of 3.46%, 17.18%, and 1.8% respectively.  With ensembles of coupled ensembles, of DenseNet-BC networks, with 50M total parameters, we obtain error rates of 2.72%, 15.13% and 1.42% respectively on these tasks.","['Ensemble learning', 'neural networks']"
14,S1347ot3b,Exploring Sentence Vectors Through Automatic Summarization,"Vector semantics, especially sentence vectors, have recently been used successfully in many areas of natural language processing. However, relatively little work has explored the internal structure and properties of spaces of sentence vectors. In this paper, we will explore the properties of sentence vectors by studying a particular real-world application: Automatic Summarization. In particular, we show that cosine similarity between sentence vectors and document vectors is strongly correlated with sentence importance and that vector semantics can identify and correct gaps between the sentences chosen so far and the document. In addition, we identify specific dimensions which are linked to effective summaries. To our knowledge, this is the first time specific dimensions of sentence embeddings have been connected to sentence properties. We also compare the features of different methods of sentence embeddings. Many of these insights have applications in uses of sentence embeddings far beyond summarization.","['Sentence Vectors', 'Vector Semantics', 'Automatic Summarization']"
15,H1A5ztj3b,Super-Convergence: Very Fast Training of Residual Networks Using Large Learning Rates,"In this paper, we show a phenomenon, which we named ``super-convergence'', where residual networks can be trained using an order of magnitude fewer iterations than is used with standard training methods.   The existence of super-convergence is relevant to understanding why deep networks generalize well.  One of the key elements of super-convergence is training with cyclical learning rates and a large maximum learning rate.  Furthermore, we present evidence that training with large learning rates improves performance by regularizing the network. In addition, we show that super-convergence provides a  greater boost in performance relative to standard training when the amount of labeled training data is limited.  We also derive a simplification of the Hessian Free optimization method to compute an estimate of the optimal learning rate.  The architectures to replicate this work will be made available upon publication.
","['Deep Learning', 'machine learning']"
16,ryH_bShhW,DOUBLY STOCHASTIC ADVERSARIAL AUTOENCODER,"Any autoencoder network can be turned into a generative model by imposing an arbitrary prior distribution on its hidden code vector. Variational Autoencoder uses a KL divergence penalty to impose the prior, whereas Adversarial Autoencoder uses generative adversarial networks.  A straightforward modification of Adversarial Autoencoder can be achieved by replacing the adversarial network with maximum mean discrepancy (MMD) network. This replacement leads to a new set of probabilistic autoencoder which is also discussed in our paper.

However, an essential challenge remains in both of these probabilistic autoencoders, namely that the only source of randomness at the output of encoder, is the training data itself.  Lack of enough stochasticity can make the optimization problem non-trivial. As a result, they can lead to degenerate solutions where the generator collapses into sampling only a few modes.

Our proposal is to replace the adversary of the adversarial autoencoder by a space of {\it stochastic} functions. This replacement introduces a a new source of randomness which can be considered as a continuous control for encouraging {\it explorations}. This prevents the adversary from fitting too closely to the generator and therefore leads to more diverse set of generated samples. Consequently, the decoder serves as a better generative network which unlike MMD nets scales linearly with the amount of data. We provide mathematical and empirical evidence on how this replacement outperforms the pre-existing architectures.   ","['Generative adversarial Networks', 'Deep Generative models', 'Kernel Methods']"
17,ryj0790hb,Incremental Learning through Deep Adaptation,"Given an existing trained neural network, it is often desirable to learn new capabilities without hindering performance of those already learned. Existing approaches either learn sub-optimal solutions, require joint training, or incur a substantial increment in the number of parameters for each added task, typically as many as the original network. We propose a method called Deep Adaptation Networks (DAN) that constrains newly learned filters to be linear combinations of existing ones. DANs preserve performance on the original task, require a fraction (typically 13%) of the number of parameters compared to standard fine-tuning procedures and converge in less cycles of training to a comparable or better level of performance. When coupled with standard network quantization techniques, we further reduce the parameter cost to around 3% of the original with negligible or no loss in accuracy. The learned architecture can be controlled to switch between various learned representations, enabling a single network to solve a task from multiple different domains. We conduct extensive experiments showing the effectiveness of our method on a range of image classification tasks and explore different aspects of its behavior.","['Transfer Learning', 'Learning without forgetting', 'Multitask Learning']"
18,SkiCjzNTZ,Spontaneous Symmetry Breaking in Deep Neural Networks,"We propose a framework to understand the unprecedented performance and robustness of deep neural networks using field theory. Correlations between the weights within the same layer can be described by symmetries in that layer, and networks generalize better if such symmetries are broken to reduce the redundancies of the weights. Using a two parameter field theory, we find that the network can break such symmetries itself towards the end of training in a process commonly known in physics as spontaneous symmetry breaking. This corresponds to a network generalizing itself without any user input layers to break the symmetry, but by communication with adjacent layers. In the layer decoupling limit applicable to residual networks (He et al., 2015), we show that the remnant symmetries that survive the non-linear layers are spontaneously broken based on empirical results. The Lagrangian for the non-linear and weight layers together has striking similarities with the one in quantum field theory of a scalar. Using results from quantum field theory we show that our framework is able to explain many experimentally observed phenomena, such as training on random labels with zero error (Zhang et al., 2017), the information bottleneck and the phase transition out of it (Shwartz-Ziv & Tishby, 2017), shattered gradients (Balduzzi et al., 2017), and many more.","['deep learning', 'physics', 'field theory']"
19,rkhCSO4T-,Distributed non-parametric deep and wide networks,"In recent work, it was shown that combining multi-kernel based support vector machines (SVMs) can lead to near state-of-the-art performance on an action recognition dataset (HMDB-51 dataset). In the present work, we show that combining distributed Gaussian Processes with multi-stream deep convolutional neural networks (CNN) alleviate the need to augment a neural network with hand-crafted features. In contrast to prior work, we treat each deep neural convolutional network as an expert wherein the individual predictions (and their respective uncertainties) are combined into a Product of Experts (PoE) framework.",[]
