,PID,Title,Abstract,Keyword
281,BJjquybCW,The loss surface and expressivity of deep convolutional neural networks,"We analyze the expressiveness and loss surface of practical deep convolutional
neural networks (CNNs) with shared weights and max pooling layers. We show
that such CNNs produce linearly independent features at a “wide” layer which
has more neurons than the number of training samples. This condition holds e.g.
for the VGG network. Furthermore, we provide for such wide CNNs necessary
and sufficient conditions for global minima with zero training error. For the case
where the wide layer is followed by a fully connected layer we show that almost
every critical point of the empirical loss is a global minimum with zero training
error. Our analysis suggests that both depth and width are very important in deep
learning. While depth brings more representational power and allows the network
to learn high level features, width smoothes the optimization landscape of the
loss function in the sense that a sufficiently wide network has a well-behaved loss
surface with almost no bad local minima.","['convolutional neural networks', 'loss surface', 'expressivity', 'critical point', 'global minima', 'linear separability']"
282,BkeC_J-R-,Combination of Supervised and Reinforcement Learning For Vision-Based Autonomous Control," Reinforcement learning methods have recently achieved impressive results on a wide range of control problems. However, especially with complex inputs, they still require an extensive amount of training data in order to converge to a meaningful solution. This limitation largely prohibits  their usage for complex input spaces such as video signals, and it is still impossible to use it for a number of complex problems in a real world environments, including many of those for video based control. Supervised learning, on the contrary, is capable of learning on a relatively small number of samples, however it does not take into account reward-based control policies and is not capable to provide independent control policies.  In this article we propose a model-free control method, which uses a combination of reinforcement and supervised learning for autonomous control and paves the way towards policy based control in real world environments. We use SpeedDreams/TORCS video game to demonstrate that our approach requires much less samples (hundreds of thousands against millions or tens of millions) comparing to the state-of-the-art reinforcement learning techniques on similar data, and at the same time overcomes both supervised and reinforcement learning approaches in terms of quality. Additionally, we demonstrate the applicability of the method to MuJoCo control problems. ","['Reinforcement learning', 'deep learning', 'autonomous control']"
283,rk8R_JWRW,Gating out sensory noise in a spike-based Long Short-Term Memory network,"Spiking neural networks are being investigated both as biologically plausible models of neural computation and also as a potentially more efficient type of neural network. While convolutional spiking neural networks have been demonstrated to achieve near state-of-the-art performance, only one solution has been proposed to convert gated recurrent neural networks, so far.
Recurrent neural networks in the form of networks of gating memory cells have been central in state-of-the-art solutions in problem domains that involve sequence recognition or generation. Here, we design an analog gated LSTM cell where its neurons can be substituted for efficient stochastic spiking neurons. These adaptive spiking neurons implement an adaptive form of sigma-delta coding to convert internally computed analog activation values to spike-trains. For such neurons, we approximate the effective activation function, which resembles a sigmoid. We show how analog neurons with such activation functions can be used to create an analog LSTM cell; networks of these cells can then be trained with standard backpropagation. We train these LSTM networks on a noisy and noiseless version of the original sequence prediction task from Hochreiter & Schmidhuber (1997), and also on a noisy and noiseless version of a classical working memory reinforcement learning task, the T-Maze. Substituting the analog neurons for corresponding adaptive spiking neurons, we then show that almost all resulting spiking neural network equivalents correctly compute the original tasks.","['spiking neural networks', 'LSTM', 'recurrent neural networks']"
284,H1DJFybC-,Learning to Infer Graphics Programs from Hand-Drawn Images,"  We introduce a model that learns to convert simple hand drawings
  into graphics programs written in a subset of \LaTeX.~The model
  combines techniques from deep learning and program synthesis.  We
  learn a convolutional neural network that proposes plausible drawing
  primitives that explain an image. These drawing primitives are like
  a trace of the set of primitive commands issued by a graphics
  program. We learn a model that uses program synthesis techniques to
  recover a graphics program from that trace. These programs have
  constructs like variable bindings, iterative loops, or simple kinds
  of conditionals. With a graphics program in hand, we can correct
  errors made by the deep network and extrapolate drawings.  Taken
  together these results are a step towards agents that induce useful,
  human-readable programs from perceptual input.","['program induction', 'HCI', 'deep learning']"
285,B1EPYJ-C-,Federated Learning: Strategies for Improving Communication Efficiency,"Federated Learning is a machine learning setting where the goal is to train a high-quality centralized model while training data remains distributed over a large number of clients each with unreliable and relatively slow network connections.  We consider learning algorithms for this setting where on each round, each client independently computes an update to the current model based on its local data, and communicates this update to a central server, where the client-side updates are aggregated to compute a new global model.  The typical clients in this setting are mobile phones, and communication efficiency is of the utmost importance. 

In this paper, we propose two ways to reduce the uplink communication costs: structured updates, where we directly learn an update from a restricted space parametrized using a smaller number of variables, e.g. either low-rank or a random mask; and sketched updates, where we learn a full model update and then compress it using a combination of quantization, random rotations, and subsampling before sending it to the server. Experiments on both convolutional and recurrent networks show that the proposed methods can reduce the communication cost by two orders of magnitude.",[]
286,rk8wKk-R-,Convolutional Sequence Modeling Revisited,"This paper revisits the problem of sequence modeling using convolutional 
architectures.  Although both convolutional and recurrent architectures have a
long history in sequence prediction, the current ""default"" mindset in much of
the deep learning community is that generic sequence modeling is best handled
using recurrent networks.  The goal of this paper is to question this assumption. 
Specifically, we consider a simple generic temporal convolution network (TCN),
which adopts features from modern ConvNet architectures such as a dilations and 
residual connections.  We show that on a variety of sequence modeling tasks,
including many frequently used as benchmarks for evaluating recurrent networks,
the TCN outperforms baseline RNN methods (LSTMs, GRUs, and vanilla RNNs) and
sometimes even highly specialized approaches.  We further show that the
potential ""infinite memory"" advantage that RNNs have over TCNs is largely
absent in practice: TCNs indeed exhibit longer effective history sizes than their 
recurrent counterparts.   As a whole, we argue that it may be time to (re)consider 
ConvNets as the default ""go to"" architecture for sequence modeling.","['Temporal Convolutional Network', 'Sequence Modeling', 'Deep Learning']"
287,SkBYYyZRZ,Searching for Activation Functions,"The choice of activation functions in deep networks has a significant effect on the training dynamics and task performance. Currently, the most successful and widely-used activation function is the Rectified Linear Unit (ReLU). Although various hand-designed alternatives to ReLU have been proposed, none have managed to replace it due to inconsistent gains. In this work, we propose to leverage automatic search techniques to discover new activation functions. Using a combination of exhaustive and reinforcement learning-based search, we discover multiple novel activation functions. We verify the effectiveness of the searches by conducting an empirical evaluation with the best discovered activation function. Our experiments show that the best discovered activation function, f(x) = x * sigmoid(beta * x), which we name Swish, tends to work better than ReLU on deeper models across a number of challenging datasets. For example, simply replacing ReLUs with Swish units improves top-1 classification accuracy on ImageNet by 0.9% for Mobile NASNet-A and 0.6% for Inception-ResNet-v2. The simplicity of Swish and its similarity to ReLU make it easy for practitioners to replace ReLUs with Swish units in any neural network. ","['meta learning', 'activation functions']"
288,ryepFJbA-,On Convergence and Stability of GANs,"We propose studying GAN training dynamics as regret minimization, which is in contrast to the popular view that there is consistent minimization of a divergence between real and generated distributions. We analyze the convergence of GAN training from this new point of view to understand why mode collapse happens. We hypothesize the existence of undesirable local equilibria in this non-convex game to be responsible for mode collapse. We observe that these local equilibria often exhibit sharp gradients of the discriminator function around some real data points. We demonstrate that these degenerate local equilibria can be avoided with a gradient penalty scheme called DRAGAN. We show that DRAGAN enables faster training, achieves improved stability with fewer mode collapses, and leads to generator networks with better modeling performance across a variety of architectures and objective functions.","['GAN', 'Generative Adversarial Networks', 'Mode Collapse', 'Stability', 'Game Theory', 'Regret Minimization', 'Convergence', 'Gradient Penalty']"
289,B1D6ty-A-,Training Autoencoders by Alternating Minimization,"We present DANTE, a novel method for training neural networks, in particular autoencoders, using the alternating minimization principle. DANTE provides a distinct perspective in lieu of traditional gradient-based backpropagation techniques commonly used to train deep networks. It utilizes an adaptation of quasi-convex optimization techniques to cast autoencoder training as a bi-quasi-convex optimization problem. We show that for autoencoder configurations with both differentiable (e.g. sigmoid) and non-differentiable (e.g. ReLU) activation functions, we can perform the alternations very effectively. DANTE effortlessly extends to networks with multiple hidden layers and varying network configurations. In experiments on standard datasets, autoencoders trained using the proposed method were found to be very promising when compared to those trained using traditional backpropagation techniques, both in terms of training speed, as well as feature extraction and reconstruction performance.","['Deep Learning', 'Autoencoders', 'Alternating Optimization']"
290,BkDB51WR-,Learning temporal evolution of probability distribution with Recurrent Neural Network,"We propose to tackle a time series regression problem by computing temporal evolution of a probability density function to provide a probabilistic forecast. A Recurrent Neural Network (RNN) based model is employed to learn a nonlinear operator for temporal evolution of a probability density function. We use a softmax layer for a numerical discretization of a smooth probability density functions, which transforms a function approximation problem to a classification task. Explicit and implicit regularization strategies are introduced to impose a smoothness condition on the estimated probability distribution. A Monte Carlo procedure to compute the temporal evolution of the distribution for a multiple-step forecast is presented. The evaluation of the proposed algorithm on three synthetic and two real data sets shows advantage over the compared baselines.","['predictive distribution estimation', 'probabilistic RNN', 'uncertainty in time series prediction']"
291,ry5wc1bCW,Causal Generative Neural Networks,"We introduce CGNN, a framework to learn functional causal models as generative neural networks. These networks are trained using backpropagation to minimize the maximum mean discrepancy to the observed data. Unlike previous approaches, CGNN leverages both conditional independences and distributional asymmetries to seamlessly discover bivariate and multivariate 
 causal structures, with or without hidden variables. CGNN does not only estimate the causal structure, but a full and differentiable generative model of the data. Throughout an extensive variety of experiments, we illustrate the competitive  esults of CGNN w.r.t state-of-the-art alternatives in observational causal discovery on both simulated and real data, in the tasks of cause-effect inference, v-structure identification, and multivariate causal discovery. ","['Causal structure discovery', 'Generative neural networks', 'Cause-effect pair problem', 'Functional causal model', 'Maximum Mean Discrepancy', 'Structural Equation Models']"
292,By3v9k-RZ,LEARNING TO ORGANIZE KNOWLEDGE WITH N-GRAM MACHINES,"Deep neural networks (DNNs) had great success on NLP tasks such as language modeling, machine translation and certain question answering (QA) tasks. However, the success is limited at more knowledge intensive tasks such as QA from a big corpus. Existing end-to-end deep QA models (Miller et al., 2016; Weston et al., 2014) need to read the entire text after observing the question, and therefore their complexity in responding a question is linear in the text size. This is prohibitive for practical tasks such as QA from Wikipedia, a novel, or the Web. We propose to solve this scalability issue by using symbolic meaning representations, which can be indexed and retrieved efficiently with complexity that is independent of the text size. More specifically, we use sequence-to-sequence models to encode knowledge symbolically and generate programs to answer questions from the encoded knowledge. We apply our approach, called the N-Gram Machine (NGM), to the bAbI tasks (Weston et al., 2015) and a special version of them (“life-long bAbI”) which has stories of up to 10 million sentences. Our experiments show that NGM can successfully solve both of these tasks accurately and efficiently. Unlike fully differentiable memory models, NGM’s time complexity and answering quality are not affected by the story length. The whole system of NGM is trained end-to-end with REINFORCE (Williams, 1992). To avoid high variance in gradient estimation, which is typical in discrete latent variable models, we use beam search instead of sampling. To tackle the exponentially large search space, we use a stabilized auto-encoding objective and a structure tweak procedure to iteratively reduce and refine the search space.
","['neuro-symbolic reasoning', 'information extraction', 'learn to search']"
293,SJahqJZAW,Stabilizing GAN Training with Multiple Random Projections,"Training generative adversarial networks is unstable in high-dimensions as the true data distribution tends to be concentrated in a small fraction of the ambient space. The discriminator is then quickly able to classify nearly all generated samples as fake, leaving the generator without meaningful gradients and causing it to deteriorate after a point in training. In this work, we propose training a single generator simultaneously against an array of discriminators, each of which looks at a different random low-dimensional projection of the data. Individual discriminators, now provided with restricted views of the input, are unable to reject generated samples perfectly and continue to provide meaningful gradients to the generator throughout training.  Meanwhile, the generator learns to produce samples consistent with the full data distribution to satisfy all discriminators simultaneously. We  demonstrate the practical utility of this approach experimentally, and show that it is able to produce image samples with higher quality than traditional training with a single discriminator.","['generative adversarial networks', 'stable training', 'low-dimensional projections', 'deep learning']"
294,S1viikbCW,TCAV: Relative concept importance testing with Linear Concept Activation Vectors,"Despite neural network’s high performance, the lack of interpretability has been the main bottleneck for its safe usage in practice. In domains with high stakes (e.g., medical diagnosis), gaining insights into the network is critical for gaining trust and being adopted. One of the ways to improve interpretability of a NN is to explain the importance of a particular concept (e.g., gender) in prediction. This is useful for explaining reasoning behind the networks’ predictions, and for revealing any biases the network may have. This work aims to provide quantitative answers to \textit{the relative importance of concepts of interest} via concept activation vectors (CAV). In particular, this framework enables non-machine learning experts to express concepts of interests and  test hypotheses using examples (e.g., a set of pictures that illustrate  the concept). We show that CAV can be learned given a relatively small set of examples. Testing with CAV, for example, can answer whether a particular concept (e.g., gender) is more important in predicting a given class (e.g., doctor) than other set of concepts. Interpreting with CAV does not require any retraining or modification of the network. We show that many levels of meaningful concepts are learned (e.g., color, texture, objects, a person’s occupation), and we present CAV’s \textit{empirical deepdream} — where we maximize an activation using a set of example pictures. We show how various insights can be gained from the relative importance testing with CAV.",[]
295,BkoXnkWAb,Shifting Mean Activation Towards Zero with Bipolar Activation Functions,"We propose a simple extension to the ReLU-family of activation functions that allows them to shift the mean activation across a layer towards zero. Combined with proper weight initialization, this alleviates the need for normalization layers. We explore the training of deep vanilla recurrent neural networks (RNNs) with up to 144 layers, and show that bipolar activation functions help learning in this setting. On the Penn Treebank and Text8 language modeling tasks we obtain competitive results, improving on the best reported results for non-gated networks. In experiments with convolutional neural networks without batch normalization, we find that bipolar activations produce a faster drop in training error, and results in a lower test error on the CIFAR-10 classification task.",[]
296,rkcya1ZAW,Continuous-Time Flows for Efficient Inference and Density Estimation,"Two fundamental problems in unsupervised learning are efficient inference for latent-variable models and robust density estimation based on large amounts of unlabeled data. For efficient inference, normalizing flows have been recently developed to approximate a target distribution arbitrarily well. In practice, however, normalizing flows only consist of a finite number of deterministic transformations, and thus they possess no guarantee on the approximation accuracy. For density estimation, the generative adversarial network (GAN) has been advanced as an appealing model, due to its often excellent performance in generating samples. In this paper, we propose the concept of {\em continuous-time flows} (CTFs), a family of diffusion-based methods that are able to asymptotically approach a target distribution. Distinct from normalizing flows and GANs, CTFs can be adopted to achieve the above two goals in one framework, with theoretical guarantees. Our framework includes distilling knowledge from a CTF for efficient inference, and learning an explicit  energy-based distribution with CTFs for density estimation. Experiments on various tasks demonstrate promising performance of the proposed CTF framework, compared to related techniques.","['continuous-time flows', 'efficient inference', 'density estimation', 'deep generative models']"
297,rJJzTyWCZ,Large-scale Cloze Test Dataset Designed by Teachers,"Cloze test is widely adopted in language exams to evaluate students' language proficiency. In this paper, we propose the first large-scale human-designed cloze test dataset CLOTH in which the questions were used in middle-school and high-school language exams. With the missing blanks carefully created by teachers and candidate choices purposely designed to be confusing, CLOTH requires a deeper language understanding and a wider attention span than previous automatically generated cloze datasets. We show humans outperform dedicated designed baseline models by a significant margin, even when the model is trained on sufficiently large external data. We investigate the source of the performance gap, trace model deficiencies to some distinct properties of CLOTH, and identify the limited ability of comprehending a long-term context to be the key bottleneck. In addition, we find that human-designed data leads to a larger gap between the model's performance and human performance when compared to automatically generated data. ","['dataset', 'human-designed', 'language understanding']"
298,B1p461b0W,Deep Learning is Robust to Massive Label Noise,"Deep neural networks trained on large supervised datasets have led to impressive results in recent years. However, since well-annotated datasets can be prohibitively expensive and time-consuming to collect, recent work has explored the use of larger but noisy datasets that can be more easily obtained. In this paper, we investigate the behavior of deep neural networks on training sets with massively noisy labels. We show on multiple datasets such as MINST, CIFAR-10 and ImageNet that successful learning is possible even with an essentially arbitrary amount of noise. For example, on MNIST we find that accuracy of above 90 percent is still attainable even when the dataset has been diluted with 100 noisy examples for each clean example. Such behavior holds across multiple patterns of label noise, even when noisy labels are biased towards confusing classes. Further, we show how the required dataset size for successful training increases with higher label noise. Finally, we present simple actionable techniques for improving learning in the regime of high label noise.","['label noise', 'weakly supervised learning', 'robustness of neural networks', 'deep learning', 'large datasets']"
299,rkmtTJZCb,Unsupervised Hierarchical Video Prediction,"Much recent research has been devoted to video prediction and generation,  but mostly for short-scale time horizons. The hierarchical video prediction method by Villegas et al. (2017) is an example of a state of the art method for long term video prediction.  However, their method has limited applicability in practical settings as it requires a ground truth pose (e.g.,  poses of joints of a human) at training time.   This paper presents a long term hierarchical video prediction model that does not have such a restriction. We show that the network learns its own higher-level structure (e.g., pose equivalent hidden variables) that works better in cases where the ground truth pose does not fully capture all of the information needed to  predict  the  next  frame.   This  method  gives  sharper  results  than  other  video prediction methods which do not require a ground truth pose, and its efficiency is shown on the Humans 3.6M and Robot Pushing datasets.","['video prediction', 'visual analogy network', 'unsupervised', 'hierarchical']"
300,rkYgAJWCZ,One-shot and few-shot learning of word embeddings,"Standard deep learning systems require thousands or millions of examples to learn a concept, and cannot integrate new concepts easily. By contrast, humans have an incredible ability to do one-shot or few-shot learning. For instance, from just hearing a word used in a sentence, humans can infer a great deal about it, by leveraging what the syntax and semantics of the surrounding words tells us. Here, we draw inspiration from this to highlight a simple technique by which deep recurrent networks can similarly exploit their prior knowledge to learn a useful representation for a new word from little data. This could make natural language processing systems much more flexible, by allowing them to learn continually from the new words they encounter.","['One-shot learning', 'embeddings', 'word embeddings', 'natural language processing', 'NLP']"
