,Year,Title,Decision,Abstract
205,2017,Capacity Releasing Diffusion for Speed and Locality.,Oral/Poster,"Diffusions and related random walk rocedures are of central imortance in many areas of machine learning, data analysis, and alied mathematics. Because they sread mass agnostically at each ste in an iterative manner, they can sometimes sread mass ``too aggressively,'' thereby failing to find the ``right'' clusters. We introduce a novel Caacity Releasing Diffusion (CRD) Process, which is both faster and stays more local than the classical sectral diffusion rocess. As an alication, we use our CRD Process to develo an imroved local algorithm for grah clustering. Our local grah clustering method can find local clusters in a model of clustering where one begins the CRD Process in a cluster whose vertices are connected better internally than externally by an $O(\log^2 n)$ factor, where $n$ is the number of nodes in the cluster. Thus, our CRD Process is the first local grah clustering algorithm that is not subject to the well-known quadratic Cheeger barrier. Our result requires a certain smoothness condition, which we exect to be an artifact of our analysis. Our emirical evaluation demonstrates imroved results, in articular for realistic social grahs where there are moderately good---but not very good---clusters."
206,2017,Hyperplane Clustering Via Dual Principal Component Pursuit,Oral/Poster,"State-of-the-art methods for clustering data drawn from a union of subsaces are based on sarse and low-rank reresentation theory and convex otimization algorithms. Existing results guaranteeing the correctness of such methods require the dimension of the subsaces to be small relative to the dimension of the ambient sace. When this assumtion is violated, as is, e.g., in the case of hyerlanes, existing methods are either comutationally too intensive (e.g., algebraic methods) or lack sufficient theoretical suort (e.g., K-Hyerlanes or RANSAC). 
In this aer we rovide theoretical and algorithmic contributions to the roblem of clustering data from a union of hyerlanes, by extending a recent subsace learning method called Dual Princial Comonent Pursuit (DPCP) to the multi-hyerlane case. We give theoretical guarantees under which, the non-convex $\ell_1$ roblem associated with DPCP admits a unique global minimizer equal to the normal vector of the most dominant hyerlane. Insired by this insight, we roose sequential (RANSAC-style) and iterative (K-Hyerlanes-style) hyerlane learning DPCP algorithms, which, via exeriments on synthetic and real data, are shown to outerform or be cometitive to the state-of-the-art."
207,2017,Combined Group and Exclusive Sparsity for Deep Neural Networks,Oral/Poster,"The number of arameters in a dee neural network is usually very large, which hels with its learning caacity but also hinders its scalability and racticality due to memorytime inefficiency and overfitting. To resolve this issue, we roose a sarsity regularization method that exloits both ositive and negative correlations among the features to enforce the network to be sarse, and at the same time remove any redundancies among the features to fully utilize the caacity of the network. Secifically, we roose to use an exclusive sarsity regularization based on (1,2)-norm, which romotes cometition for features between different weights, thus enforcing them to fit to disjoint sets of features. We further combine the exclusive sarsity with the grou sarsity based on (2,1)-norm, to romote both sharing and cometition for features in training of a dee neural network. We validate our method on multile ublic datasets, and the results show that our method can obtain more comact and efficient networks while also imroving the erformance over the base networks with full weights, as oosed to existing sarsity regularizations that often obtain efficiency at the exense of rediction accuracy.
"
208,2017,Input Switched Affine Networks: An RNN Architecture Designed for Interpretability,Oral/Poster,"There exist many roblem domains where the interretability of neural network models is essential for deloyment. Here we introduce a recurrent architecture comosed of inut-switched affine transformations - in other words an RNN without any exlicit nonlinearities, but with inut-deendent recurrent weights. This simle form allows the RNN to be analyzed via straightforward linear methods: we can exactly characterize the linear contribution of each inut to the model redictions; we can use a change-of-basis to disentangle inut, outut, and comutational hidden unit subsaces; we can fully reverse-engineer the architecture's solution to a simle task. Desite this ease of interretation, the inut switched affine network achieves reasonable erformance on a text modeling tasks, and allows greater comutational efficiency than networks with standard nonlinearities.
"
209,2017,StingyCD: Safely Avoiding Wasteful Updates in Coordinate Descent,Oral/Poster,"Coordinate descent (CD) is a scalable and simle algorithm for solving many otimization roblems in machine learning.
Desite this fact, CD can also be very comutationally wasteful. 
Due to sarsity in sarse regression roblems, for examle, the majority of CD udates often result in no rogress toward the solution.
To address this inefficiency, we roose a modified CD algorithm named ""StingyCD.""
By skiing over many udates that are guaranteed to not decrease the objective value, StingyCD significantly reduces convergence times.
Since StingyCD only skis udates with this guarantee, however, StingyCD does not fully exloit the roblem's sarsity.
For this reason, we also roose StingyCD+, an algorithm that achieves further seed-us by skiing udates more aggressively.
Since StingyCD and StingyCD+ rely on simle modifications to CD, it is also straightforward to use these algorithms with other aroaches to scaling otimization.
In emirical comarisons, StingyCD and StingyCD+ imrove convergence times considerably for several L1-regularized otimization roblems.
"
210,2017,Contextual Decision Processes with low Bellman rank are PAC-Learnable,Oral/Poster,"This aer studies systematic exloration for reinforcement learning (RL) with rich observations and function aroximation. We introduce contextual decision rocesses (CDPs), that unify most rior RL settings. Our first contribution is a comlexity measure, the Bellman rank, that we show enables tractable learning of near-otimal behavior in CDPs and is naturally small for many well-studied RL models. Our second contribution is a new RL algorithm that does systematic exloration to learn near-otimal behavior in CDPs with low Bellman rank. The algorithm requires a number of samles that is olynomial in all relevant arameters but indeendent of the number of unique contexts. Our aroach uses Bellman error minimization with otimistic exloration and rovides new insights into efficient exloration for RL with function aroximation.
"
211,2017,Tensor Belief Propagation,Oral/Poster,"We roose a new aroximate inference algorithm for grahical models, tensor belief roagation, based on aroximating the messages assed in the junction tree algorithm. Our algorithm reresents the otential functions of the grahical model and all messages on the junction tree comactly as mixtures of rank-1 tensors. Using this reresentation, we show how to erform the oerations required for inference on the junction tree efficiently: marginalisation can be comuted quickly due to the factored form of rank-1 tensors while multilication can be aroximated using samling. Our analysis gives sufficient conditions for the algorithm to erform well, including for the case of high-treewidth grahs, for which exact inference is intractable. We comare our algorithm exerimentally with several aroximate inference algorithms and show that it erforms well.
"
212,2017,Deep Generative Models for Relational Data with Side Information,Oral/Poster,"We resent a robabilistic framework for overlaing community discovery and link rediction for relational data, given as a grah. The roosed framework has: (1) a dee architecture which enables us to infer multile layers of latent featurescommunities for each node, roviding suerior link rediction erformance on more comlex networks and better interretability of the latent features; and (2) a regression model which allows directly conditioning the node latent features on the side information available in form of node attributes. Our framework handles both (1) and (2) via a clean, unified model, which enjoys full local conjugacy via data augmentation, and facilitates efficient inference via closed form Gibbs samling. Moreover, inference cost scales in the number of edges which is attractive for massive but sarse networks. Our framework is also easily extendable to model weighted networks with count-valued edges.  We comare with various state-of-the-art methods and reort results, both quantitative and qualitative, on several benchmark data sets.
"
213,2017,Doubly Accelerated Methods for Faster CCA and Generalized Eigendecomposition,Oral/Poster,"We study k-GenEV, the roblem of finding the to k generalized eigenvectors, and k-CCA, the roblem of finding the to k vectors in canonical-correlation analysis. We roose algorithms LazyEV and LazyCCA to solve the two roblems with running times linearly deendent on the inut size and on k.

Furthermore, our algorithms are \emh{doubly-accelerated}: our running times deend only on the square root of the matrix condition number, and on the square root of the eigenga. This is the first such result for both k-GenEV or k-CCA. We also rovide the first ga-free results, which rovide running times that deend on 1\sqrt{\varesilon}$ rather than the eigenga.
"
214,2017,Multilevel Clustering via Wasserstein Means,Oral/Poster,"We roose a novel aroach to the roblem of multilevel clustering, which aims to simultaneously artition data in each grou and discover grouing atterns among grous in a otentially large hierarchically structured corus of data. Our method involves a joint otimization formulation over several saces of discrete robability measures, which are endowed with Wasserstein distance metrics. We roose a number of variants of this roblem, which admit fast otimization algorithms, by exloiting the connection to the roblem of finding Wasserstein barycenters.  Consistency roerties are established for the estimates of both local and global clusters. Finally, exeriment results with both synthetic and real data are resented to demonstrate the flexibility and scalability of the roosed aroach.
"
215,2017,Online and Linear-Time Attention by Enforcing Monotonic Alignments,Oral/Poster,"Recurrent neural network models with an attention mechanism have roven to be extremely effective on a wide variety of sequence-to-sequence roblems. However, the fact that soft attention mechanisms erform a ass over the entire inut sequence when roducing each element in the outut sequence recludes their use in online settings and results in a quadratic time comlexity. Based on the insight that the alignment between inut and outut sequence elements is monotonic in many roblems of interest, we roose an end-to-end differentiable method for learning monotonic alignments which, at test time, enables comuting attention online and in linear time. We validate our aroach on sentence summarization, machine translation, and online seech recognition roblems and achieve results cometitive with existing sequence-to-sequence models.
"
216,2017,Stochastic modified equations and adaptive stochastic gradient algorithms,Oral/Poster,"We develo the method of stochastic modified equations (SME), in which stochastic gradient algorithms are aroximated in the weak sense by continuous-time stochastic differential equations. We exloit the continuous formulation together with otimal control theory to derive novel adative hyer-arameter adjustment olicies. Our algorithms have cometitive erformance with the added benefit of being robust to varying models and datasets. This rovides a general methodology for the analysis and design of stochastic gradient algorithms. 
"
217,2017,A Simple Multi-Class Boosting Framework with Theoretical Guarantees and Empirical Proficiency,Oral/Poster,"There is a need for simle yet accurate white-box learning systems that train quickly and with little data. To this end, we showcase REBEL, a multi-class boosting method, and resent a novel family of weak learners called localized similarities. Our framework rovably minimizes the training error of any dataset at an exonential rate.
We carry out exeriments on a variety of synthetic and real datasets, demonstrating a consistent tendency to avoid overfitting. We evaluate our method on MNIST and standard UCI datasets against other state-of-the-art methods, showing the emirical roficiency of our method.
"
218,2017,Faster Greedy MAP Inference for Determinantal Point Processes,Oral/Poster,"Determinantal oint rocesses (DPPs) are oular robabilistic models that arise in many machine learning tasks, where distributions of diverse sets are characterized by determinants of their features. In this aer, we develo fast algorithms to find the most likely configuration (MAP) of large-scale DPPs, which is NP-hard in general. Due to the submodular nature of the MAP objective, greedy algorithms have been used with emirical success. Greedy imlementations require comutation of log-determinants, matrix inverses or solving linear systems at each iteration. We resent faster imlementations of the greedy algorithms by utilizing the orthogonal benefits of two log-determinant aroximation schemes: (a) first-order exansions to the matrix log-determinant function and (b) high-order exansions to the scalar log function with stochastic trace estimators. In our exeriments, our algorithms are orders of magnitude faster than their cometitors, while sacrificing marginal accuracy.
"
219,2017,ChoiceRank: Identifying Preferences from Node Traffic in Networks,Oral/Poster,"Understanding how users navigate in a network is of high interest in many alications. We consider a setting where only aggregate node-level traffic is observed and tackle the task of learning edge transition robabilities. We cast it as a reference learning roblem, and we study a model where choices follow Luce's axiom. In this case, the O(n) marginal counts of node visits are a sufficient statistic for the O(n^2) transition robabilities. We show how to make the inference roblem well-osed regardless of the network's structure, and we resent ChoiceRank, an iterative algorithm that scales to networks that contains billions of nodes and edges. We aly the model to two clickstream datasets and show that it successfully recovers the transition robabilities using only the network structure and marginal (node-level) traffic data. Finally, we also consider an alication to mobility networks and aly the model to one year of rides on New York City's bicycle-sharing system.
"
220,2017,On the Iteration Complexity of Support Recovery via Hard Thresholding Pursuit,Oral/Poster,"Recovering the suort of a sarse signal from its comressed samles has been one of the most imortant roblems in high dimensional statistics. In this aer, we resent a novel analysis for the hard thresholding ursuit (HTP) algorithm, showing that it exactly recovers the suort of an arbitrary s-sarse signal within O(sklogk) iterations via a roerly chosen roxy function, where k is the condition number of the roblem. In stark contrast to the theoretical results in the literature, the iteration comlexity we obtained holds without assuming the restricted isometry roerty, or relaxing the sarsity, or utilizing the otimality of the underlying signal. We further extend our result to a more challenging scenario, where the subroblem involved in HTP cannot be solved exactly. We rove that even in this setting, suort recovery is ossible and the comutational comlexity of HTP is established. Numerical study substantiates our theoretical results.
"
221,2017,Uniform Deviation Bounds for k-Means Clustering,Oral/Poster,"Uniform deviation bounds limit the difference between a model's exected loss and its loss on an emirical samle emuniformlyem for all models in a learning roblem. In this aer, we rovide a novel framework to obtain uniform deviation bounds for loss functions which are emunboundedem. As a result, we obtain cometitive uniform deviation bounds for k-Means clustering under weak assumtions on the underlying distribution. If the fourth moment is bounded, we rove a rate of O(m^(-12)) comared to the reviously known O(m^(-14)) rate. Furthermore, we show that the rate also deends on the kurtosis - the normalized fourth moment which measures the ""tailedness"" of a distribution. We also rovide imroved rates under rogressively stronger assumtions, namely, bounded higher moments, subgaussianity and bounded suort of the underlying distribution.
"
222,2017,Sequence Tutor: Conservative fine-tuning of sequence generation models with KL-control,Oral/Poster,"This aer rooses a general method for imroving the structure and quality of sequences generated by a recurrent neural network (RNN), while maintaining information originally learned from data, as well as samle diversity. An RNN is first re-trained on data using maximum likelihood estimation (MLE), and the robability distribution over the next token in the sequence learned by this model is treated as a rior olicy. Another RNN is then trained using reinforcement learning (RL) to generate higher-quality oututs that account for domain-secific incentives while retaining roximity to the rior olicy of the MLE RNN. To formalize this objective, we derive novel off-olicy RL methods for RNNs from KL-control. The effectiveness of the aroach is demonstrated on two alications; 1) generating novel musical melodies, and 2) comutational molecular generation. For both roblems, we show that the roosed method imroves the desired roerties and structure of the generated sequences, while maintaining information learned from data. 
"
223,2017,Dissipativity Theory for Nesterov's Accelerated Method,Oral/Poster,"In this aer, we adat the control theoretic concet of dissiativity theory to rovide a natural understanding of Nesterov's accelerated method. Our theory ties rigorous convergence rate analysis to the hysically intuitive notion of energy dissiation. Moreover, dissiativity allows one to efficiently construct Lyaunov functions (either numerically or analytically) by solving a small semidefinite rogram. Using novel suly rate functions, we show how to recover known rate bounds for Nesterov's method and we generalize the aroach to certify both linear and sublinear rates in a variety of settings. Finally, we link the continuous-time version of dissiativity to recent works on algorithm analysis that use discretizations of ordinary differential equations.
"
224,2017,Gradient Boosted Decision Trees for High Dimensional Sparse Output,Oral/Poster,"In this aer, we study the gradient boosted decision trees (GBDT) when the outut sace is high dimensional and sarse. For examle, in multilabel classification, the outut sace is a $L$-dimensional 01 vector, where $L$ is number of labels that can grow to millions and beyond in many modern alications. We show that vanilla GBDT can easily run out of memory or encounter near-forever running time in this regime, and roose a new GBDT variant, GBDT-SPARSE, to resolve this roblem by emloying $L_0$ regularization. We then discuss in detail how to utilize this sarsity to conduct GBDT training, including slitting the nodes, comuting the sarse residual, and redicting in sublinear time. Finally, we aly our algorithm to extreme multilabel classification roblems, and show that the roosed GBDT-SPARSE achieves an order of magnitude imrovements in model size and rediction time over existing methods, while yielding similar erformance."
225,2017,Zonotope hit-and-run for efficient sampling from projection DPPs,Oral/Poster,"Determinantal oint rocesses (DPPs) are distributions over sets of items that model diversity using kernels. Their alications in machine learning include summary extraction and recommendation systems.   Yet, the cost of samling from a DPP is rohibitive in large-scale alications, which has triggered an  effort towards efficient aroximate samlers.  We build a novel MCMC samler that combines ideas from combinatorial geometry, linear rogramming, and Monte Carlo methods to samle from DPPs with a fixed samle cardinality, also called rojection DPPs. Our samler leverages the ability of the hit-and-run MCMC kernel to efficiently move across convex bodies. Previous theoretical results yield a fast mixing time of our chain when targeting a distribution that is close to a rojection DPP, but not a DPP in general. Our emirical results demonstrate that this extends to samling rojection DPPs, i.e., our samler is more samle-efficient than revious aroaches which in turn translates to faster convergence when dealing with costly-to-evaluate functions, such as summary extraction in our exeriments. 
"
226,2017,Statistical Inference for Incomplete Ranking Data: The Case of Rank-Dependent Coarsening,Oral/Poster,"We consider the roblem of statistical inference for ranking data, secifically rank aggregation, under the assumtion that samles are incomlete in the sense of not comrising all choice alternatives. In contrast to most existing methods, we exlicitly model the rocess of turning a full ranking into an incomlete one, which we call the coarsening rocess. To this end, we roose the concet of rank-deendent coarsening, which assumes that incomlete rankings are roduced by rojecting a full ranking to a random subset of ranks. For a concrete instantiation of our model, in which full rankings are drawn from a Plackett-Luce distribution and observations take the form of airwise references, we study the erformance of various rank aggregation methods. In addition to redictive accuracy in the finite samle setting, we address the theoretical question of consistency, by which we mean the ability to recover a target ranking when the samle size goes to infinity, desite a otential bias in the observations caused by the (unknown) coarsening.
"
227,2017,Dual Iterative Hard Thresholding: From Non-convex Sparse Minimization to Non-smooth Concave Maximization,Oral/Poster,"Iterative Hard Thresholding (IHT) is a class of rojected gradient descent methods for otimizing sarsity-constrained minimization models, with the best known efficiency and scalability in ractice. As far as we know, the existing IHT-style methods are designed for sarse minimization in rimal form. It remains oen to exlore duality theory and algorithms in such a non-convex and NP-hard setting. In this article, we bridge the ga by establishing a duality theory for sarsity-constrained minimization with $\ell_2$-regularized objective and roosing an IHT-style algorithm for dual maximization. Our sarse duality theory rovides a set of sufficient and necessary conditions under which the original NP-hardnon-convex roblem can be equivalently solved in a dual sace. The roosed dual IHT algorithm is a suer-gradient method for maximizing the non-smooth dual objective. An interesting finding is that the sarse recovery erformance of dual IHT is invariant to the Restricted Isometry Proerty (RIP), which is required by all the existing rimal IHT without sarsity relaxation. Moreover, a stochastic variant of dual IHT is roosed for large-scale stochastic otimization. Numerical results demonstrate that dual IHT algorithms can achieve more accurate model estimation given small number of training data and have higher comutational efficiency than the state-of-the-art rimal IHT-style algorithms."
228,2017,Uniform Convergence Rates for Kernel Density Estimation,Oral/Poster,"Kernel density estimation (KDE) is a oular nonarametric density estimation method. We (1) derive finite-samle high-robability density estimation bounds for multivariate KDE under mild density assumtions which hold uniformly in $x \in \mathbb{R}^d$ and bandwidth matrices. We aly these results to (2) mode, (3) density level set, and (4) class robability estimation and attain otimal rates u to logarithmic factors. We then (5) rovide an extension of our results under the manifold hyothesis. Finally, we (6) give uniform convergence results for local intrinsic dimension estimation."
229,2017,Deep Voice: Real-time Neural Text-to-Speech,Oral/Poster,"We resent Dee Voice, a roduction-quality text-to-seech system constructed entirely from dee neural networks. Dee Voice lays the groundwork for truly end-to-end neural seech synthesis. The system comrises five major building blocks: a segmentation model for locating honeme boundaries, a graheme-to-honeme conversion model, a honeme duration rediction model, a fundamental frequency rediction model, and an audio synthesis model. For the segmentation model, we roose a novel way of erforming honeme boundary detection with dee neural networks using connectionist temoral classification (CTC) loss. For the audio synthesis model, we imlement a variant of WaveNet that requires fewer arameters and trains faster than the original. By using a neural network for each comonent, our system is simler and more flexible than traditional text-to-seech systems, where each comonent requires laborious feature engineering and extensive domain exertise. Finally, we show that inference with our system can be erformed faster than real time and describe otimized WaveNet inference kernels on both CPU and GPU that achieve u to 400x seedus over existing imlementations.
"
