,Year,Title,Decision,Abstract
0,2017,Decoupled Neural Interfaces using Synthetic Gradients,Oral/Poster,"Training directed neural networks tyically requires forward-roagating data through a comutation grah, followed by backroagating error signal, to roduce weight udates. All layers, or more generally, modules, of the network are therefore locked, in the sense that they must wait for the remainder of the network to execute forwards and roagate error backwards before they can be udated. In this work we break this constraint by decouling modules by introducing a model of the future comutation of the network grah. These models redict what the result of the modelled subgrah will roduce using only local information. In articular we focus on modelling error gradients: by using the modelled \emh{synthetic gradient} in lace of true backroagated error gradients we decoule subgrahs, and can udate them indeendently and asynchronously \ie~we realise \emh{decouled neural interfaces}. We show results for feed-forward models, where every layer is trained asynchronously, recurrent neural networks (RNNs) where redicting one's future gradient extends the time over which the RNN can effectively model, and also a hierarchical RNN system with ticking at different timescales. Finally, we demonstrate that in addition to redicting gradients, the same framework can be used to redict inuts, resulting in models which are decouled in both the forward and backwards ass -- amounting to indeendent networks which co-learn such that they can be comosed into a single functioning cororation.
"
1,2017,PixelCNN Models with Auxiliary Variables for Natural Image Modeling,Oral/Poster,"We study robabilistic models of natural images and extend the autoregressive family of PixelCNN models by incororating auxiliary variables. Subsequently, we describe two new generative image models that exloit different image transformations as auxiliary variables: a quantized grayscale view of the image or a multi-resolution image yramid. The roosed models tackle two known shortcomings of existing PixelCNN models: 1) their tendency to focus on low-level image details, while largely ignoring high-level image information, such as object shaes, and 2) their comutationally costly rocedure for image samling. We exerimentally demonstrate benefits of our models, in articular showing that they roduce much more realistically looking image samles than revious state-of-the-art robabilistic models.
"
2,2017,Tight Bounds for Approximate Carathéodory and Beyond,Oral/Poster,"We resent a deterministic nearly-linear time algorithm for aroximating any oint inside a convex olytoe with a sarse convex combination of the olytoe's vertices. Our result rovides a constructive roof for the Aroximate Carathéodory Problem, which states that any oint inside a olytoe contained in the $\ell_$ ball of radius $D$ can be aroximated to within $\esilon$ in $\ell_$ norm by a convex combination of $O\left(D^2 \esilon^2\right)$ vertices of the olytoe for $ \geq 2$. While for the articular case of $=2$, this can be achieved by the well-known Percetron algorithm, we follow a more rinciled aroach which generalizes to arbitrary $\geq 2$; furthermore, this naturally extends to domains with more comlicated geometry, as it is the case for roviding an aroximate Birkhoff-von Neumann decomosition. Secondly, we show that the sarsity bound is tight for $\ell_$ norms, using an argument based on anti-concentration for the binomial distribution, thus resolving an oen question osed by Barman. Exerimentally, we verify that our deterministic otimization-based algorithms achieve in ractice much better sarsity than reviously known samling-based algorithms. We also show how to aly our techniques to SVM training and rounding fractional oints in matroid and flow olytoes."
3,2017,Robust Adversarial Reinforcement Learning,Oral/Poster,"Dee neural networks couled with fast simulation and imroved comutational seeds have led to recent successes in the field of reinforcement learning (RL). However, most current RL-based aroaches fail to generalize since: (a) the ga between simulation and real world is so large that olicy-learning aroaches fail to transfer; (b) even if olicy learning is done in real world, the data scarcity leads to failed generalization from training to test scenarios (e.g., due to different friction or object masses). Insired from H-infinity control methods, we note that both modeling errors and differences in training and test scenarios can just be viewed as extra forcesdisturbances in the system. This aer rooses the idea of robust adversarial reinforcement learning (RARL), where we train an agent to oerate in the resence of a destabilizing adversary that alies disturbance forces to the system. The jointly trained adversary is reinforced -- that is, it learns an otimal destabilization olicy. 
We formulate the olicy learning as a zero-sum, minimax objective function. Extensive exeriments in multile environments (InvertedPendulum, HalfCheetah, Swimmer, Hoer, Walker2d and Ant) conclusively demonstrate that our method  (a) imroves training stability;  (b) is robust to differences in trainingtest conditions; and c) outerform the baseline even in the absence of the adversary.
"
4,2017,Robust Probabilistic Modeling with Bayesian Data Reweighting,Oral/Poster,"Probabilistic models analyze data by relying on a set of assumtions.
Data that exhibit deviations from these assumtions can undermine
inference and rediction quality. Robust models offer rotection
against mismatch between a model's assumtions and reality. We
roose a way to systematically detect and mitigate mismatch of a
large class of robabilistic models. The idea is to raise the
likelihood of each observation to a weight and then to infer both the
latent variables and the weights from data. Inferring the weights
allows a model to identify observations that match its assumtions
and down-weight others. This enables robust inference and imroves
redictive accuracy. We study four different forms of mismatch with
reality, ranging from missing latent grous to structure
missecification. A Poisson factorization analysis of the Movielens
1M dataset shows the benefits of this aroach in a ractical
scenario.
"
5,2017,Multi-objective Bandits: Optimizing the Generalized Gini Index,Oral/Poster,"We study the multi-armed bandit (MAB) roblem where the agent receives a vectorial feedback that encodes many ossibly cometing objectives to be otimized. The goal of the agent is to find a olicy, which can otimize these objectives simultaneously in a fair way. This multi-objective online otimization roblem is formalized by using the Generalized Gini Index (GGI) aggregation function. We roose an online gradient descent algorithm which exloits the convexity of the GGI aggregation function, and controls the exloration in a careful way achieving a distribution-free regret $\tilde{\bigO} (T^{-12} )$ with high robability. We test our algorithm on synthetic data as well as on an electric battery control roblem where the goal is to trade off the use of the different cells of a battery in order to balance their resective degradation rates."
6,2017,Communication-efficient Algorithms for Distributed Stochastic Principal Component Analysis,Oral/Poster,"We study the fundamental roblem of Princial Comonent Analysis in a statistical distributed setting in which each machine out of m stores a samle of n oints samled i.i.d. from a single unknown distribution. We study algorithms for estimating the leading rincial comonent of the oulation covariance matrix that are both communication-efficient and achieve estimation error of the order of the centralized ERM solution that uses all mn samles. On the negative side, we show that in contrast to results obtained for distributed estimation under convexity assumtions, for the PCA objective, simly averaging the local ERM solutions cannot guarantee error that is consistent with the centralized ERM. We show that this unfortunate henomena can be remedied by erforming a simle correction ste which correlates between the individual solutions, and rovides an estimator that is consistent with the centralized ERM for sufficiently-large n. 
We also introduce an iterative distributed algorithm that is alicable in any regime of n, which is based on distributed matrix-vector roducts. The algorithm gives significant acceleration in terms of communication rounds over revious distributed algorithms, in a wide regime of arameters.
"
7,2017,Enumerating Distinct Decision Trees,Oral/Poster,"The search sace for the feature selection roblem in decision tree learning is the lattice of subsets of the available features. We rovide an exact enumeration rocedure of the subsets that lead to all and only the distinct decision trees. The rocedure can be adoted to rune the search sace of comlete and heuristics search methods in wraer models for feature selection. Based on this, we design a comutational otimization of the sequential backward elimination heuristics with a erformance imrovement of u to 100X.
"
8,2017,Understanding Synthetic Gradients and Decoupled Neural Interfaces,Oral/Poster,"When training neural networks, the use of Synthetic Gradients (SG) allows layers or modules to be trained without udate locking - without waiting for a true error gradient to be backroagated -resulting in Decouled Neural Interfaces (DNIs). This unlocked ability of being able to udate arts of a neural network asynchronously and with only local information was demonstrated to work emirically in Jaderberg et al (2016). However, there has been very little demonstration of what changes DNIs and SGs imose from a functional, reresentational, and learning dynamics oint of view. In this aer, we study DNIs through the use of synthetic gradients on feed-forward networks to better understand their behaviour and elucidate their effect on otimisation. We show that the incororation of SGs does not affect the reresentational strength of the learning system for a neural network, and rove the convergence of the learning system for linear and dee linear models. On ractical roblems we investigate the mechanism by which synthetic gradient estimators aroximate the true loss, and, surrisingly, how that leads to drastically different layer-wise reresentations. Finally, we also exose the relationshi of using synthetic gradients to other error aroximation techniques and find a unifying language for discussion and comarison. 
"
9,2017,Parallel Multiscale Autoregressive Density Estimation,Oral/Poster,"PixelCNN achieves state-of-the-art results in density estimation for natural images. Although training is fast, inference is costly, requiring one network evaluation er ixel; O(N) for N ixels. This can be sed u by caching activations, but still involves generating each ixel sequentially. In this work, we roose a arallelized PixelCNN that allows more efficient inference by modeling certain ixel grous as conditionally indeendent. Our new PixelCNN model achieves cometitive density estimation and orders of magnitude seedu - O(log N) samling instead of O(N) - enabling the ractical generation of 512x512 images. We evaluate the model on class-conditional image generation, text-to-image synthesis, and action-conditional video generation, showing that our model achieves the best results among non-ixel-autoregressive density models that allow efficient samling.
"
10,2017,Oracle Complexity of Second-Order Methods for Finite-Sum Problems,Oral/Poster,"Finite-sum otimization roblems are ubiquitous in machine learning, and are commonly solved using first-order methods which rely on gradient comutations. Recently, there has been growing interest in \emh{second-order} methods, which rely on both gradients and Hessians. In rincile, second-order methods can require much fewer iterations than first-order methods, and hold the romise for more efficient algorithms. Although comuting and maniulating Hessians is rohibitive for high-dimensional roblems in general, the Hessians of individual functions in finite-sum roblems can often be efficiently comuted, e.g. because they ossess a low-rank structure. Can second-order information indeed be used to solve such roblems more efficiently? In this aer, we rovide evidence that the answer -- erhas surrisingly -- is negative, at least in terms of worst-case guarantees. However, we also discuss what additional assumtions and algorithmic aroaches might otentially circumvent this negative result. 
"
11,2017,Minimax Regret Bounds for Reinforcement Learning,Oral/Poster,"We consider the roblem of rovably otimal exloration in reinforcement learning for finite horizon MDPs.
We show that an otimistic modification to value iteration achieves a regret bound of $\tilde {O}( \sqrt{HSAT} + H^2S^2A+H\sqrt{T})$ where $H$ is the time horizon, $S$ the number of states, $A$ the number of actions and $T$ the number of time-stes.
This result imroves over the best revious known bound $\tilde {O}(HS \sqrt{AT})$ achieved by the UCRL2 algorithm. 
The key significance of our new results is that when  $T\geq H^3S^3A$ and $SA\geq H$, it leads to a regret of $\tilde{O}(\sqrt{HSAT})$ that matches the established lower bound of $\Omega(\sqrt{HSAT})$ u to a logarithmic factor.
Our analysis contain two key insights.
We use careful alication of concentration inequalities to the otimal value function as a whole, rather than to the transitions robabilities (to imrove scaling in $S$), and we use ""exloration bonuses"" built from Bernstein's  inequality, together with using a recursive -Bellman-tye- Law of Total Variance (to imrove scaling in $H$)."
12,2017,Post-Inference Prior Swapping,Oral/Poster,"While Bayesian methods are raised for their ability to incororate useful rior knowledge, in ractice, convenient riors that allow for comutationally chea or tractable inference are commonly used. In this aer, we investigate the following question: for a given model, is it ossible to comute an inference result with any convenient false rior, and afterwards, given any target rior of interest, quickly transform this result into the target osterior? A otential solution is to use imortance samling (IS). However, we demonstrate that IS will fail for many choices of the target rior, deending on its arametric form and similarity to the false rior. Instead, we roose rior swaing, a method that leverages the re-inferred false osterior to efficiently generate accurate osterior samles under arbitrary target riors. Prior swaing lets us aly less-costly inference algorithms to certain models, and incororate new or udated rior information “ost-inference”. We give theoretical guarantees about our method, and demonstrate it emirically on a number of models and riors.
"
13,2017,Online Learning with Local Permutations and Delayed Feedback,Oral/Poster,"We roose an Online Learning with Local Permutations (OLLP) setting, in which the learner is allowed to slightly ermute the \emh{order} of the loss functions generated by an adversary. On one hand, this models natural situations where the exact order of the learner's resonses is not crucial, and on the other hand, might allow better learning and regret erformance, by mitigating highly adversarial loss sequences. Also, with random ermutations, this can be seen as a setting interolating between adversarial and stochastic losses. In this aer, we consider the 
alicability of this setting to convex online learning with delayed feedback, in which the feedback on the rediction made in round $t$ arrives with some delay $\tau$. With such delayed feedback, the best ossible regret bound is well-known to be $O(\sqrt{\tau T})$. We rove that by being able to ermute losses by a distance of at most $M$ (for $M\geq \tau$), the regret can be imroved to $O(\sqrt{T}(1+\sqrt{\tau^2M}))$, using a Mirror-Descent based algorithm which can be alied for both Euclidean and non-Euclidean geometries. We also rove a lower bound, showing that for $M\tau3$, it is imossible to imrove the standard $O(\sqrt{\tau T})$ regret bound by more than constant factors. Finally, we rovide some exeriments validating the erformance of our algorithm."
14,2017,SPLICE: Fully Tractable Hierarchical Extension of ICA with Pooling,Oral/Poster,"We resent a novel robabilistic framework for a hierarchical extension of indeendent comonent analysis (ICA), with a articular motivation in neuroscientific data analysis and modeling. The framework incororates a general subsace ooling with linear ICA-like layers stacked recursively. Unlike related revious models, our generative model is fully tractable: both the likelihood and the osterior estimates of latent variables can readily be comuted with analytically simle formulae. The model is articularly simle in the case of comlex-valued data since the ooling can be reduced to taking the modulus of comlex numbers. Exeriments on electroencehalograhy (EEG) and natural images demonstrate the validity of the method.
"
15,2017,Simultaneous Learning of Trees and Representations for Extreme Classification and Density Estimation,Oral/Poster,"We consider multi-class classification where the redictor has a hierarchical structure that allows for a very large number of labels both at train and test time. The redictive ower of such models can heavily deend on the structure of the tree, and although ast work showed how to learn the tree structure, it exected that the feature vectors remained static. We rovide a novel algorithm to simultaneously erform reresentation learning for the inut data and learning of the hierarchical redictor. Our aroach otimizes an objective function which favors balanced and easily-searable multi-way node artitions. We theoretically analyze this objective, showing that it gives rise to a boosting style roerty and a bound on classification error. We next show how to extend the algorithm to conditional density estimation. We emirically validate both variants of the algorithm on text classification and language modeling, resectively, and show that they comare favorably to common baselines in terms of accuracy and running time.
"
16,2017,meProp: Sparsified Back Propagation for Accelerated Deep Learning with Reduced Overfitting,Oral/Poster,"We roose a simle yet effective technique for neural network learning. The forward roagation is comuted as usual. In back roagation, only a small subset of the full gradient is comuted to udate the model arameters. The gradient vectors are sarsified in such a way that only the to-$k$ elements (in terms of magnitude) are ket. As a result, only $k$ rows or columns (deending on the layout) of the weight matrix are modified, leading to a linear reduction ($k$ divided by the vector dimension) in the comutational cost. Surrisingly, exerimental results demonstrate that we can udate only 1--4\% of the weights at each back roagation ass. This does not result in a larger number of training iterations. More interestingly, the accuracy of the resulting models is actually imroved rather than degraded, and a detailed analysis is given."
17,2017,Video Pixel Networks,Oral/Poster,"We  roose  a  robabilistic  video  model, the Video Pixel Network (VPN), that estimates the  discrete  joint  distribution  of  the  raw  ixel  values  in  a  video.   The  model  and  the  neural  architecture reflect the time, sace and color structure  of  video  tensors  and  encode  it  as  a   four-dimensional  deendency  chain.  The  VPN  aroaches  the  best  ossible  erformance  on  the Moving MNIST benchmark, a lea over the revious state of the art,  and the generated  videos show  only  minor  deviations from  the  ground truth. The  VPN  also  roduces  detailed  samles  on  the  action-conditional Robotic  Pushing benchmark  and  generalizes  to  the  motion of novel objects.
"
18,2017,Global optimization of Lipschitz functions,Oral/Poster,"The goal of the aer is to design sequential strategies which lead to efficient otimization of an unknown function under the only assumtion that it has a finite Lischitz constant. We first identify sufficient conditions for the consistency of generic sequential algorithms and formulate the exected minimax rate for their erformance. We introduce and analyze a first algorithm called LIPO which assumes the Lischitz constant to be known. Consistency, minimax rates for LIPO are roved, as well as fast rates under an additional H\""older like condition. An adative version of LIPO is also introduced for the more realistic setu where Lischitz constant is unknown and has to be estimated along with the otimization. Similar theoretical guarantees are shown to hold for the adative LIPO algorithm and a numerical assessment is rovided at the end of the aer to illustrate the otential of this strategy with resect to state-of-the-art methods over tyical benchmark roblems for global otimization.
"
19,2017,Fairness in Reinforcement Learning,Oral/Poster,"We initiate the study of fairness in reinforcement learning, where the actions of a learning algorithm may affect its environment and future rewards. Our fairness constraint requires that an algorithm never refers one action over another if the long-term (discounted) reward of choosing the latter action is higher. Our first result is negative: desite the fact that fairness is consistent with the otimal olicy, any learning algorithm satisfying fairness must take time exonential in the number of states
to achieve non-trivial aroximation to the otimal olicy.  We then rovide a rovably fair olynomial time algorithm under an aroximate notion of fairness, thus establishing an exonential ga between exact and aroximate fairness.
"
20,2017,Evaluating Bayesian Models with Posterior Dispersion Indices,Oral/Poster,"Probabilistic modeling is cyclical: we secify a model, infer its osterior, and evaluate its erformance. Evaluation drives the cycle, as we revise our model based on how it erforms. This requires a metric. Traditionally, redictive accuracy revails. Yet, redictive accuracy does not tell the whole story. We roose to evaluate a model through osterior disersion. The idea is to analyze how each dataoint fares in relation to osterior uncertainty around the hidden structure. This highlights dataoints the model struggles to exlain and rovides comlimentary insight to dataoints with low redictive accuracy. We resent a family of osterior disersion indices (PDI) that cature this idea. We show how a PDI identifies atterns of model mismatch in three real data examles: voting references, suermarket shoing, and oulation genetics.
"
21,2017,Model-Independent Online Learning for Influence Maximization,Oral/Poster,"We consider \emh{influence maximization} (IM) in social networks, which is the roblem of maximizing the number of users that become aware of a roduct by selecting a set of ``seed'' users to exose the roduct to. While rior work assumes a known model of information diffusion, we roose a novel arametrization that not only makes our framework agnostic to the underlying diffusion model, but also statistically efficient to learn from data. We give a corresonding monotone, submodular surrogate function, and show that it is a good aroximation to the original IM objective. We also consider the case of a new marketer looking to exloit an existing social network, while simultaneously learning the factors governing information roagation. For this, we roose a airwise-influence semi-bandit feedback model and develo a LinUCB-based bandit algorithm. Our model-indeendent analysis shows that our regret bound has a better (as comared to revious work) deendence on the size of the network. Exerimental evaluation suggests that our framework is robust to the underlying diffusion model and can efficiently learn a near-otimal solution.
"
22,2017,Latent Feature Lasso,Oral/Poster,"The latent feature model (LFM), roosed in \cite{griffiths2005infinite}, but ossibly with earlier origins, is a generalization of a mixture model, where each instance is generated not from a single latent class but from a combination of \emh{latent features}. Thus, each instance has an associated  latent binary feature incidence vector indicating the resence or absence of a feature. Due to its combinatorial nature, inference of LFMs is considerably intractable, and accordingly, most of the attention has focused on nonarametric LFMs, with riors such as the Indian Buffet Process (IBP) on infinite binary matrices. Recent efforts to tackle this comlexity either still have comutational comlexity that is exonential, or samle comlexity that is high-order olynomial w.r.t. the number of latent features. In this aer, we address this outstanding roblem of tractable estimation of LFMs via a novel atomic-norm regularization, which gives an algorithm with olynomial run-time and samle comlexity without imractical assumtions on the data distribution.
"
