,Year,Title,Decision,Abstract
326,2017,Optimal Algorithms for Smooth and Strongly Convex Distributed Optimization in Networks,Oral/Poster,"In this aer, we determine the otimal convergence rates for strongly convex and smooth distributed otimization in two settings: centralized and decentralized communications over a network. For centralized (i.e. masterslave) algorithms, we show that distributing Nesterov's accelerated gradient descent is otimal and achieves a recision $\varesilon  0$ in time $O(\sqrt{\kaa_g}(1+\Delta\tau)\ln(1\varesilon))$, where $\kaa_g$ is the condition number of the (global) function to otimize, $\Delta$ is the diameter of the network, and $\tau$ (res. $1$) is the time needed to communicate values between two neighbors (res. erform local comutations). For decentralized algorithms based on gossi, we rovide the first otimal algorithm, called the multi-ste dual accelerated (MSDA) method, that achieves a recision $\varesilon  0$ in time $O(\sqrt{\kaa_l}(1+\frac{\tau}{\sqrt{\gamma}})\ln(1\varesilon))$, where $\kaa_l$ is the condition number of the local functions and $\gamma$ is the (normalized) eigenga of the gossi matrix used for communication between nodes. We then verify the efficiency of MSDA against state-of-the-art methods for two roblems: least-squares regression and classification by logistic regression."
327,2017,Prediction under Uncertainty in Sparse Spectrum Gaussian Processes with Applications to Filtering and Control,Oral/Poster,"Sarse Sectrum Gaussian Processes (SSGPs) are a owerful tool for scaling Gaussian rocesses (GPs) to large datasets. Existing SSGP algorithms for regression assume deterministic inuts, recluding their use in many real-world robotics and engineering alications where accounting for inut uncertainty is crucial. We address this roblem by roosing two analytic moment-based aroaches with closed-form exressions for SSGP regression with uncertain inuts. Our methods are more general and scalable than their standard GP counterarts, and are naturally alicable to multi-ste rediction or uncertainty roagation. We show that efficient algorithms for Bayesian filtering and stochastic model redictive control can use these methods, and we evaluate our algorithms with comarative analyses and both real-world and simulated exeriments.
"
328,2017,Canopy --- Fast Sampling with Cover Trees,Oral/Poster,"Hierarchical Bayesian models often cature distributions over a very large number of distinct atoms.
The need for these models arises when organizing huge amount of unsuervised data, for instance, features extracted using dee convnets that can be exloited to organize abundant unlabeled images.
Inference for hierarchical Bayesian models in such cases can be rather nontrivial, leading to aroximate aroaches.
In this work, we roose \emh{Canoy}, a samler based on Cover Trees that is exact, has guaranteed runtime logarithmic in the number of atoms, and is rovably olynomial in the inherent dimensionality of the underlying arameter sace.
In other words, the algorithm is as fast as search over a hierarchical data structure.
We rovide theory for Canoy and demonstrate its effectiveness on both synthetic and real datasets, consisting of over 100 million images.
"
329,2017,Bayesian Optimization with Tree-structured Dependencies,Oral/Poster,"Bayesian otimization has been successfully used to otimize comlex black-box functions whose evaluations are exensive. In many alications, like in dee learning and redictive analytics, the otimization domain is itself comlex and structured. In this work, we focus on use cases where this domain exhibits a known deendency structure. The benefit of leveraging this structure is twofold: we exlore the search sace more efficiently and osterior inference scales more favorably with the number of observations than Gaussian Process-based aroaches ublished in the literature. We introduce a novel surrogate model for Bayesian otimization which combines indeendent Gaussian Processes with a linear model that encodes a tree-based deendency structure and can transfer information between overlaing decision sequences. We also design a secialized  two-ste acquisition function that exlores the search sace more effectively. Our exeriments on synthetic tree-structured functions and the tuning of feedforward neural networks trained on a range of binary classification datasets show that our method comares favorably with cometing aroaches.
"
330,2017,High-Dimensional Structured Quantile Regression,Oral/Poster,"Quantile regression aims at modeling the conditional median and quantiles of a resonse variable given certain redictor variables. In this work we consider the roblem of linear quantile regression in high dimensions where the number of redictor variables is much higher than the number of samles available for arameter estimation. We assume the true arameter to have some structure characterized as having a small value according to some atomic norm R(.) and consider the norm regularized quantile regression estimator. We characterize the samle comlexity for consistent recovery and give non-asymtotic bounds on the estimation error. While this roblem has been reviously considered, our analysis reveals geometric and statistical characteristics of the roblem not available in rior literature. We erform exeriments on synthetic data which suort the theoretical results.
"
331,2017,Differentially Private Submodular Maximization: Data Summarization in Disguise,Oral/Poster,"Many data summarization alications are catured by the general framework of submodular maximization. As a consequence,  a wide range of efficient aroximation algorithms have been develoed. However, when such alications involve sensitive data about individuals, their rivacy concerns are not automatically addressed. To remedy this roblem, we roose a general and systematic study of differentially rivate submodular maximization. We resent rivacy-reserving algorithms for both monotone and non-monotone submodular maximization under cardinality, matroid, and -extendible system constraints, with guarantees that are cometitive with otimal. Along the way, we analyze a new algorithm for non-monotone submodular maximization, which is the first (even non-rivately) to achieve a constant aroximation ratio while running in linear time. We additionally rovide two concrete exeriments to validate the efficacy of these algorithms. 
"
332,2017,Learning to Detect Sepsis with a Multitask Gaussian Process RNN Classifier,Oral/Poster,"We resent a scalable end-to-end classifier that uses streaming hysiological and medication data to accurately redict the onset of sesis, a life-threatening comlication from infections that has high mortality and morbidity.  Our roosed framework models the multivariate trajectories of continuous-valued hysiological time series using multitask Gaussian rocesses, seamlessly accounting for the high uncertainty, frequent missingness, and irregular samling rates tyically associated with real clinical data.  The Gaussian rocess is directly connected to a black-box classifier that redicts whether a atient will become setic, chosen in our case to be a recurrent neural network to account for the extreme variability in the length of atient encounters.  We show how to scale the comutations associated with the Gaussian rocess in a manner so that the entire system can be discriminatively trained end-to-end using backroagation.   In a large cohort of heterogeneous inatient encounters at our university health system we find that it outerforms several baselines at redicting sesis, and yields 19.4\% and 55.5\% imroved areas under the Receiver Oerating Characteristic and Precision Recall curves as comared to the NEWS score currently used by our hosital.
"
333,2017,Beyond Filters: Compact Feature Map for Portable Deep Model,Oral/Poster,"Convolutional neural networks (CNNs) have shown extraordinary erformance in a number of alications, but they are usually of heavy design for the accuracy reason. Beyond comressing the filters in CNNs, this aer focuses on the redundancy in the feature mas derived from the large number of filters in a layer. We roose to extract intrinsic reresentation of the feature mas and reserve the discriminability of the features. Circulant matrix is emloyed to formulate the feature ma transformation, which only requires O(dlog d) comutation comlexity to embed a d-dimensional feature ma. The filter is then re-configured to establish the maing from original inut to the new comact feature ma, and the resulting network can reserve intrinsic information of the original network with significantly fewer arameters, which not only decreases the online memory for launching CNN but also accelerates the comutation seed. Exeriments on benchmark image datasets demonstrate the sueriority of the roosed algorithm over state-of-the-art methods.
"
334,2017,Image-to-Markup Generation with Coarse-to-Fine Attention,Oral/Poster,"We resent a neural encoder-decoder model to convert images into resentational marku based on a scalable coarse-to-fine attention mechanism. Our method is evaluated in the context of image-to-LaTeX generation, and we introduce a new dataset of real-world rendered mathematical exressions aired with LaTeX marku. We show that unlike neural OCR techniques using CTC-based models, attention-based aroaches can tackle this non-standard OCR task. Our aroach outerforms classical mathematical OCR systems by a large margin on in-domain rendered data, and, with retraining, also erforms well on out-of-domain handwritten data. To reduce the inference comlexity associated with the attention-based aroaches, we introduce a new coarse-to-fine attention layer that selects a suort region before alying attention.
"
335,2017,Projection-free Distributed Online Learning in Networks,Oral/Poster,"The conditional gradient algorithm has regained a surge of research interest in recent years due to its high efficiency in handling large-scale machine learning roblems. However, none of existing studies has exlored it in the distributed online learning setting, where locally light comutation is assumed. In this aer, we fill this ga by roosing the distributed online conditional gradient algorithm, which eschews the exensive rojection oeration needed in its counterart algorithms by exloiting much simler linear otimization stes. We give a regret bound for the roosed algorithm as a function of the network size and toology, which will be smaller on smaller grahs or ""well-connected"" grahs. Exeriments on two large-scale real-world datasets for a multiclass classification task confirm the comutational benefit of the roosed algorithm and also verify the theoretical regret bound.
"
336,2017,Learning Stable Stochastic Nonlinear Dynamical Systems,Oral/Poster,"A data-driven identification of dynamical systems requiring only minimal rior knowledge is romising whenever no analytically derived model structure is available, e.g., from first rinciles in hysics. However,    meta-knowledge on the system's behavior is often given and should be exloited: Stability as fundamental roerty is essential when the model is used for controller design or movement generation. Therefore, this aer  rooses a framework for learning stable stochastic systems from data. We focus on identifying a state-deendent coefficient form of the nonlinear stochastic model which is globally asymtotically stable according to robabilistic Lyaunov methods. We comare our aroach to other state of the art methods on real-world datasets in terms of flexibility and   stability.
"
337,2017,A Simulated Annealing Based Inexact Oracle for Wasserstein Loss Minimization,Oral/Poster,"Learning under a Wasserstein loss, a.k.a. Wasserstein loss minimization (WLM), is an emerging research toic for gaining insights from a large set of structured objects. Desite being concetually simle, WLM roblems are comutationally challenging because they involve minimizing over functions of quantities (i.e. Wasserstein distances) that themselves require numerical algorithms to comute. In this aer, we introduce a stochastic aroach based on simulated annealing for solving WLMs. Particularly, we have develoed a Gibbs samler to aroximate effectively and efficiently the artial gradients of a sequence of Wasserstein losses. Our new aroach has the advantages of numerical stability and readiness for warm starts. These characteristics are valuable for WLM roblems that often require multile levels of iterations in which the oracle for comuting the value and gradient of a loss function is embedded. We alied the method to otimal transort with Coulomb cost and the Wasserstein non-negative matrix factorization roblem, and made comarisons with the existing method of entroy regularization. 
"
338,2017,Multi-fidelity Bayesian Optimisation with Continuous Approximations,Oral/Poster,"Bandit methods for black-box otimisation, such as Bayesian otimisation,
are used in a variety of alications including hyer-arameter tuning and
exeriment design.
Recently, \emh{multi-fidelity} methods have garnered
considerable attention since function evaluations have become increasingly exensive in
such alications.
Multi-fidelity methods use chea aroximations to the function of
interest to seed u the overall otimisation rocess.
However, most multi-fidelity methods assume only a finite number of aroximations.
On the other hand, in many ractical alications, a continuous sectrum of aroximations might be
available.
For instance, when tuning an exensive neural network, one might choose to aroximate the
cross validation erformance using less data $N$ andor few training iterations $T$.
Here, the aroximations are best viewed as arising out of a continuous two dimensional
sace $(N,T)$.
In this work, we develo a Bayesian otimisation method, \boca, for this setting.
We characterise its theoretical roerties and show that it achieves better regret than
than strategies which ignore the aroximations.
\bocas outerforms several other baselines in synthetic and real exeriments."
339,2017,High-dimensional Non-Gaussian Single Index Models via Thresholded Score Function Estimation,Oral/Poster,"We consider estimating the arametric comonent​ ​of single index models in high dimensions.​ ​Comared with existing work,​ ​we do not require the covariate to be normally​ ​distributed. Utilizing Stein’s Lemma,​ ​we roose estimators based on the score​ ​function of the covariate. Moreover, to handle​ ​​score function and resonse variables​ ​that are heavy-tailed, our estimators are constructed​ ​via carefully thresholding their emirical​ ​counterarts. Under a bounded fourth​ ​moment condition, we establish otimal statistical​ ​rates of convergence for the roosed​ ​estimators. Extensive numerical exeriments​ ​are rovided to back u our theory.
"
340,2017,Differentially Private Learning of Graphical Models using CGMs,Oral/Poster,"We investigate the roblem of learning discrete grahical models in a differentially rivate way. Aroaches to this roblem range from rivileged algorithms that conduct learning comletely behind the rivacy barrier to schemes that release rivate summary statistics aired with algorithms to learn arameters from those statistics. We show that the aroach of releasing noisy sufficient statistics using the Lalace mechanism achieves a good trade-off between rivacy, utility, and racticality. A naive learning algorithm that uses the noisy sufficient statistics ``as is'' outerforms general-urose differentially rivate learning algorithms. However, it has three limitations: it ignores knowledge about the data generating rocess, rests on uncertain theoretical foundations, and exhibits certain athologies. We develo a more rinciled aroach that alies the formalism of collective grahical models to erform inference over the true sufficient statistics within an exectation-maximization framework. We show that this learns better models than cometing aroaches on both synthetic data and on real human mobility data used as a case study.
"
341,2017,"iSurvive: An Interpretable, Event-time Prediction Model for mHealth",Oral/Poster,"An imortant mobile health (mHealth) task is the use of multimodal data, such as sensor streams and self-reort, to construct interretable time-to-event redictions of, for examle, lase to alcohol or illicit drug use.  Interretability of the rediction model is imortant for accetance and adotion by domain scientists, enabling model oututs and arameters to inform theory and guide intervention design.  Temoral latent state models are therefore attractive, and so we adot the continuous time hidden Markov model (CT-HMM) due to its ability to describe irregular arrival times of event data.  Standard CT-HMMs, however, are not secialized for redicting the time to a future event, the key variable for mHealth interventions.  Also, standard emission models lack a sufficiently rich structure to describe multimodal data and incororate domain knowledge.  We resent iSurvive, an extension of classical survival analysis to a CT-HMM.  We resent a arameter learning method for GLM emissions and survival model fitting, and resent romising results on both synthetic data and an mHealth drug use dataset.
"
342,2017,Efficient softmax approximation for GPUs,Oral/Poster,"We roose an aroximate strategy to efficiently train neural network based language models over very large vocabularies. Our aroach, called adative softmax, circumvents the linear deendency on the vocabulary size by exloiting the unbalanced word distribution to form clusters that exlicitly minimize the exectation of comutation time. Our aroach further
reduces the comutational cost by exloiting the secificities of modern architectures and matrix-matrix vector oerations, making it articularly suited for grahical rocessing units. Our exeriments carried out on standard benchmarks, such as EuroParl and One Billion Word, show that our aroach brings a large gain in efficiency over standard aroximations while achieving an accuracy close to that of the full softmax. The code of our method is available at htts:github.comfacebookresearchadative-softmax.
"
343,2017,Multichannel End-to-end Speech Recognition,Oral/Poster,"The field of seech recognition is in the midst of a aradigm shift: end-to-end neural networks are challenging the dominance of hidden Markov models as a core technology. Using an attention mechanism in a recurrent encoder-decoder architecture solves the dynamic time alignment roblem, allowing joint end-to-end training of the acoustic and language modeling comonents. In this aer we extend the end-to-end framework to encomass microhone array signal rocessing for noise suression and seech enhancement within the acoustic encoding network. This allows the beamforming comonents to be otimized jointly within the recognition architecture to imrove the end-to-end seech recognition objective. Exeriments on the noisy seech benchmarks (CHiME-4 and AMI) show that our multichannel end-to-end system outerformed the attention-based baseline with inut from a conventional adative beamformer.
"
344,2017,Local Bayesian Optimization of Motor Skills,Oral/Poster,"Bayesian otimization is renowned for its samle efficiency but its alication to higher dimensional tasks is imeded by its focus on global otimization. To scale to higher dimensional roblems, we leverage the samle efficiency of Bayesian otimization in a local context. The otimization of the acquisition function is restricted to the vicinity of a Gaussian search distribution which is moved towards high value areas of the objective. The roosed information-theoretic udate of the search distribution results in a Bayesian interretation of local stochastic search: the search distribution encodes rior
knowledge on the otimum’s location and is weighted at each iteration by the likelihood of this location’s otimality. We demonstrate the
effectiveness of our algorithm on several benchmark objective functions as well as a continuous robotic task in which an informative rior is obtained by imitation learning.
"
345,2017,Improving Gibbs Sampler Scan Quality with DoGS,Oral/Poster,"The airwise influence matrix of Dobrushin has long been used as an analytical tool to bound the rate of convergence of Gibbs samling. In this work, we use Dobrushin influence as the basis of a ractical tool to certify and efficiently imrove the quality of a Gibbs samler. Our Dobrushin-otimized Gibbs samlers (DoGS) offer customized variable selection orders for a given samling budget and variable subset of interest, exlicit bounds on total variation distance to stationarity, and certifiable imrovements over the standard systematic and uniform random scan Gibbs samlers. In our exeriments with image segmentation, Markov chain Monte Carlo maximum likelihood estimation, and Ising model inference, DoGS consistently deliver higher-quality inferences with significantly smaller samling budgets than standard Gibbs samlers.
"
346,2017,Parallel and Distributed Thompson Sampling for Large-scale Accelerated Exploration of Chemical Space,Oral/Poster,"Chemical sace is so large that brute force searches for new interesting
molecules are infeasible. High-throughut virtual screening via comuter cluster simulations can seed u the discovery rocess by collecting very large amounts of data in arallel, e.g., u to hundreds or thousands of arallel measurements. Bayesian otimization (BO) can roduce additional acceleration by sequentially identifying the most useful simulations or exeriments to be erformed next. However, current BO methods cannot scale to the large numbers of arallel measurements and the massive libraries of molecules currently used in high-throughut screening. Here, we roose a scalable solution based on a arallel and distributed imlementation of Thomson samling (PDTS). We show that, in small scale roblems, PDTS erforms similarly as arallel exected imrovement (EI), a batch version of the most widely used BO heuristic. Additionally, in settings where arallel EI does not scale, PDTS outerforms other scalable baselines such as a greedy search, esilon-greedy aroaches and a random search method. These results show that PDTS is a successful solution for large-scale arallel BO.
"
347,2017,Robust Structured Estimation with Single-Index Models,Oral/Poster,"In this aer, we investigate general single-index models (SIMs) in high dimensions. Based on U-statistics, we roose two tyes of robust estimators for the recovery of model arameters, which can be viewed as generalizations of several existing algorithms for one-bit comressed sensing (1-bit CS). With minimal assumtion on noise, the statistical guarantees are established for the generalized estimators under suitable conditions, which allow general structures of underlying arameter. Moreover, the roosed estimator is novelly instantiated for SIMs with monotone transfer function, and the obtained estimator can better leverage the monotonicity. Exerimental results are rovided to suort our theoretical analyses.
"
348,2017,Minimizing Trust Leaks for Robust Sybil Detection,Oral/Poster,"Sybil detection is a crucial task to rotect online social networks (OSNs) against 
intruders who try to maniulate automatic services rovided by OSNs to their customers.
In this aer, 
we first discuss the robustness of grah-based Sybil detectors SybilRank and Integro and refine theoretically their security guarantees 
towards more realistic assumtions. 
After that, we formally introduce adversarial settings for the grah-based Sybil detection roblem 
and derive a corresonding otimal attacking strategy by exloitation of trust leaks.
Based on our analysis, we roose transductive Sybil ranking (TSR), a robust extension to SybilRank and Integro that directly minimizes trust leaks. 
Our emirical evaluation shows significant advantages of TSR 
over state-of-the-art cometitors on a variety of attacking scenarios on artificially generated data and real-world datasets.
"
349,2017,Learning Sleep Stages from Radio Signals: A Conditional Adversarial Architecture,Oral/Poster,"We focus on redicting slee stages from radio measurements without any attached sensors on subjects. 
We introduce a new redictive model that combines convolutional and recurrent neural networks to extract slee-secific subject-invariant features from RF signals and cature the temoral rogression of slee.  A key innovation underlying our aroach is a modified adversarial training regime that discards extraneous information secific to individuals or measurement conditions, while retaining all information relevant to the redictive task.
We analyze our game theoretic setu and emirically demonstrate that our model achieves significant imrovements over state-of-the-art solutions.
"
